url,category,date_published,headline,news_text,date
https://nepalbhasatimes.com/34395,न्ह्यइपुख्यः,११४० यँलागा आमै,मांया गुण लुमंका हालातःगु म्ये सार्वजनिक,"येँ – थः मांयात समर्पण यानाः दयेकूगु नेपालभाषाया म्येया म्युजिक भिडियो थौं युट्युब मार्फत सार्वजनिक जूगु दु । म्ये हालामि सलिल सुन्दर तुलाधरं थः मां रुपशोभा तुलाधरयात समर्पण यानाः दयेकूगु म्ये ‘यः मां’या म्यूजिक भिडियो थौं हाइलाइट्स नेपालया युट्युब च्यानल पाखें सार्वजनिक जूगु खः ।                                                         म्ये हालामि तुलाधरया मां मदुगु ४५ न्हुया पुण्यतिथि लाकाः संगीतबद्ध यायेगु व रेकर्ड याःगु थ्व म्येया म्युजिक भिडियो दछिया पुण्य तिथि लाकाः सार्वजनिक याःगु खः । मतिना प्रोडक्सनं तयार याःगु म्यूजिक भिडियोया निर्देशक नांजाःम्ह निर्देशक विजु कर्माचार्यं यानादीगु दुसा थुकी मन्जु श्रेष्ठ, दिपक मगर व सर्निका राजोपाध्यायं अभिनय यानातःगु दु । छायांकन अमर चित्रकारं याःगु खःसा सह निर्देशन व भिएफएक्स महेश्वर श्रेष्ठया दु । मांया गुण चित्रण यानाः संसारय् न्ह्याम्हेसित नं दक्कले माया याइम्ह देवी समानया मांया वियोग गुलि दुःखदायी जुइ धैगु भावना कःघानाः तयार यानातःगु थूगु दु । म्येया संगीत संयोजन अन्जन श्रेष्ठं याःगु दुसा रण बहादुर ताम्राकारं म्ये च्वज्याय् ग्वाहालि याःगु दु । थूगु म्येया हालामिलिसें संगीतकार व रचनाकार सलिल सुन्दर तुलाधरं नेपाल भाषा संगीतय् छपलाः एल्बम, मखं त्वाःया कायमचा नापं मेमेगु नं लोकंह्वाःगु म्ये हालादीधुंकूगु दु । अथेहे नेपाली संगीत लागाय् ड्याम ड्याम थें जाःगु लोकंह्वाःगु म्ये बियादीधुंकूगु दुसा नेपाली संकिपा निजर्लाय् भाले मोटर, चोखो मायामा तिमी नै हौ, थें जाःगु म्ये नं हालादीगु दु । म्ये स्वयादिसँ –  ","September 17, 2020 11:09 AM"
https://nepalbhasatimes.com/29382,न्ह्यइपुख्यः,११४० चिल्लाथ्व पुन्हि,बुदिंया भिंतुना म्येँ कासाय् उत्कृष्ट कासामिया म्येँचाः पिदन,"यल – बुदिंया भिंतुना म्येँ कासाय् उत्कृष्ट जुइत ताःलाःपिं न्याम्ह कासामिया म्येँचाः पिदंगु दु। कासाय् उत्कृष्ट न्याम्ह कासामिया सः दुथ्याःगु म्येँ मुना ‘सिरपाः’ आः नकतिनि छगू ज्याझ्वःया दथुइ पितब्वज्या जुल ।                                                         नेपालभाषा सांगीतिक ख्यलय् नांजाःम्ह कलाकार सुरजवीर वज्राचार्यं मंगल धुनया लसय् ‘लय्ताः जि अति थौं, जन्मदिं छंगु’ म्येँयात कयाः ग्वसाः ग्वयादीगु चेज बुदिंया भिंतुना म्येँ कासाय् उत्कृष्ट न्यागू थासय् वयेत ताःलाःपिं कलाकारया सः दुथ्याकाः उगु म्येँचाः पिथंगु खः । सुरजवीर थम्हं हे च्वयाः हालादीगु म्येँय् संगीत संयोजन जुगल डंगोलं यानादीगु खःसा म्येँ कासाय् १२१ म्हेसिनं ब्वति काःगु खः । पेज थ्री बाःछिपौया ग्वसालय् चेज टेलिभिजनया मुख्य प्रायोजनय् जूगु कासाय् उत्कृष्ट न्याम्ह कासामिया सः दुथ्याःगु म्येँचालय् सुरजवीर  ज्राचार्य, दर्शनवीर शाक्य, प्रकाशदीप श्रेष्ठ, पूर्णकाजी ज्यापु व हरिराम महर्जनं च्वयादीगु म्येँ दुथ्यानाच्वंगु दु। वय्कःपिंसं च्वयादीगु म्येँयात छसिकथं कासाय् न्हाप लाःम्ह उत्तम महर्जन, मुकेश शाक्य, सुमन मानन्धर, रविन्सन कसाः व परमेश मल्लं सः बियादीगु खः । म्येँचालय् दुथ्याःगु म्येँया संगीत संयोजन डंगोलं हे यानादीगु खःसा उगु म्येँ आर्टोम्युज रेकर्डिब स्टुडियोय् जूगु खः । थनया लाय्कू नासः चुकय् जूगु ज्याझ्वलय् वरिष्ठ म्येँ हालामि जुजुकाजी रंजित, जनसंगीत श्रष्टा अमरराज शर्मा, इलोहं प्रकाशनया नरेशवीर शाक्य, यल मनपा १६ या वडाअध्यक्ष निर्मलरत्न शाक्य, संगीतकार जुगल डंगोल, आर्टोम्यूजया प्रवन्ध निर्देशक केञ्जुमा सुब्बा, चेज टेलिभिजन उत्पादक गोल्मा कम्पनीया प्रमुख सुरेश मल्ल, हिरण्यवर्ण महाविहारया आजु चित्रवीर वज्राचार्य व नेपाल घरेलु तथा साना उद्योग महासंघया पूर्व अध्यक्ष सुरेश प्रधानं मंकाः कथं म्येँचाःया पितब्वज्या यानादीगु खः । ज्याझ्वःया संयोजक दर्शनवीर शाक्य व यल मनपा १६ वडाअध्यक्ष शाक्यं नं नुगःखँ तयादीगु ज्याझ्वः यल मनपा १६ वडा या सह आयोजनाय् जूगु खः ।","March 09, 2020 11:35 AM"
https://nepalbhasatimes.com/33354,न्ह्यइपुख्यः,११४० गुंलाथ्व नवमी,मचा प्रतिभाय् उत्कृष्ट जूपिनिगु नां घोषणा,"येँ (नेपालभाषा टाइम्स) – वर्ल्ड नेवाः अर्गनाइजेसन (डब्लुएनओ)या ग्वसालय् ‘ग्लोबल नेवाः चिल्ड्रेन ट्यालेन्ट कम्पिटिशन-२०२०’ नामं जूगु मचा प्रतिभा कासाय् उत्कृष्ट जूपिनिगु नां घोषणा याःगु दु। कासाय् खुदँ क्वय् व खुदँ च्वय्या मुक्कं पीगुम्हेसिनं थःथःगु प्रतिभा न्ह्यब्वःगु खः ।                                                         ग्वसाः खलकं बिउगु जानकारीकथं खुदँ क्वय् खुम्ह व खुदँ च्वय् पीस्वम्ह मस्तय्सं थःथःगु प्रतिभा न्ह्यब्वःगु खः । छम्ह हे कासामिं व्यक्तिगत व पुचःकथं तःगू प्रतिभा न्ह्यब्वयाः ब्वति काये जिउगु मचा प्रतिभा कासाय् उमेर समूहय् स्वम्ह स्वम्ह व सामाजिक संजालय् भ्युज व लाइकया लिधंसाय् प्यम्ह यानाः झिंम्हेसित उत्कृष्ट घोषणा याःगु खः । खुदँ तकया उमेर समूहय् संकिपा श्रेष्ठ, आर्जल डंगोल व आरिया महर्जन उत्कृष्ट जुयादीगु खःसा खुदँ च्वय्या उमेर समूहय् सजगता मानन्धर, सिम्रिक श्रेष्ठ व सुबिना, स्वजला, आर्शमा महर्जन व एन्जेला श्रेष्ठया पुचलं सिरपाः त्याकेत सफल जूगु खः । उमेर समूहय् उत्कृष्ट जूपिं सकसिनं म्हतिं न्याद्वः, न्याद्वः सिरपाः त्याकेत सफल जूगु दु । अथे हे सामाजिक संजालपाखे पल्पसा प्रधान न्हाप, प्रथम श्रेष्ठ लिउ, नेरिशा महर्जन लियांलिउ व अयुष्का जोशीं हःपाः सिरपाः त्याकेत ताःलाःगु दु। थुगु पुचलय् उत्कृष्ट जूपिंसं छसिकथं न्याद्वः, स्वद्वः, निद्वः व द्वःछि तका सिरपाः त्याकादीगु दु । कासाय् वरिष्ठ सिने पत्रकार विजय असंबरे, म्येँ हालामि सरिष्मा अमात्य व कलाकारलिसें संचारकःमि अजय देसारया निर्णायक पुचलं प्रतिभापाखे व प्रविण शाक्यं सामाजिक संजालपाखे उत्कृष्टया नां घोषणा यानादीगु खः । कासाय् ब्वति  कयादीपिं सकसितं हःपाःकथं म्हतिं द्वःछि तका बीगु कजि दिपेश शाक्यं कनादिल । डब्लुएनओया नायः सिजन श्रेष्ठया सभापतित्वय् किपू नगरपालिकाया प्रमुख रमेश महर्जनं मूपाहांकथं ब्वति कयादीगु भर्चुअल ज्याझ्वलय् सांसद राजेन्द्र श्रेष्ठ, नेवाः न्ह्यलुवा मल्ल के. सुन्दर, नेवाः देय् दबूया नायः नरश ताम्राकार, संस्थाया संस्थापक दुजः दया शाक्य, कलाकार नगिना जोशी व ज्यापु महागुथिया नायः राजभाई जकःमिपिंसं पाहांकथं ब्वति कयादीगु खःसा ग्वसाः खलःया कृष्ण चखुं नं सुभाय् देछानादीगु खः ।","July 29, 2020 12:45 PM"
https://nepalbhasatimes.com/33077,न्ह्यइपुख्यः,११४० दिल्लागा चर्हे,नेपालभाषाया म्येँया अडियो च्यानल न्ह्यात,येँ (नेपालभाषा टाइम्स) – चांन्हि मदिक्क नेपालभाषाया म्ये न्यने दइगु न्हूगु अडियो च्यानल न्ह्याःगु दु । जनकवि दुर्गालाल श्रेष्ठया बुन्हिया लसताय् लाकाः वरिष्ठ म्ये हालामि जुजुकाजी रञ्जितं बिहीवाः सुकुन्दाय् मत च्याकाः उलेज्या यानादीगु खः ।                                                         जनकवि श्रेष्ठं अनलाइनं ज्याझ्वलय् ब्वति कासें च्यानल मदिक्क न्ह्यानाच्वनेमा धकाः भिंतुनादीगु खः । येँया एएनजे स्टुडियोया सङ्गीतकःमिपिं आभाष जोशी व जीनु जोशीं बटम क्लिक यानाः च्यानलय् म्ये हायेकादीगु खः । रमेश जोशीं संयोजन यानादीगु थुगु च्यानल  www.newamey.com  य् चांन्हि न्ह्यागु इलय् नं न्यनेफइगु जानकारी ब्यूगु दु । थुगु च्यानल सुथांलाक्क न्ह्याकेया नितिं बिद्यासागर प्रधान (अमेरिका) व उज्ज्वल कुमार जोशीं (जर्मनीं) ग्वाहालि याना च्वनादीगु दु ।,"July 19, 2020 12:57 PM"
https://nepalbhasatimes.com/28991,न्ह्यइपुख्यः,११४० सिल्लागा द्वादशी ,ख्यालि न्हिली,"तःन्हु न्ह्यवंनिसें थःछेँय् वनाच्वंम्ह कलाः लिहां वल । भाःतम्हं खापा चायेकखतं ततसलं न्हिल । थ्व खनाः कलाःम्हं धाल— ‘छाय् ? छु जुल छितः ? भाःत ः छुं नं मजू । कलाः ः अले छाय् थपाय्सकं न्हिला दियागु ले छि ? ‘छम्ह ज्योतिषं धाःगु’— भाःतम्हं धाल— ‘जब जिगु न्ह्यःने समस्या वइ अबलय् ततःसलं न्हिला बिउ । ह्ह्ह् पाउजु वा घंघला सः न्यनेबलय् हे थुलि आनन्द वः कि खँ ल्हानां साध्य हे मजू । छक्वः विचाः यानादिसँ सा यदि व हे सः चान्हसिया १, २ बजे वल धाःसा…. ह्ह्ह् अपराधी ः हेलो सा’ब छिगु हालखबर छु दु ? प्रहरी ः अँ एकदम ‘फाइन’ । अपराधी ः क्याः ….. गजब खः बाः हालखबर छु दु धकाः न्यनेवं तुं जरिवाना पुलेमाःगु ला ?","February 20, 2020 07:15 AM"
https://nepalbhasatimes.com/35504,न्ह्यइपुख्यः,११४० कौलाथ्व त्रयोदशी ,मालश्री धुन हेभी मेटलय्,"येँ (नेपालभाषा टाइम्स) – मोहनि नखःया लसताय् न्हूकथंया मालश्री धुन सार्वजनिक याःगु दु । खिं, पछिमा, सितार, तानपुरा, जलतरंग आदि परम्परागत लोकबाजं जक छ्यलाः मालश्री धुन पिहां वयाच्वंगु इलय् लिपांगु इलय् हेभी मेटलया फ्युजन यानाः मालश्री धुन सार्वजनिक याःगु खः । ‘द लाखे ब्याण्डं’ हेभी मेटलया लसय् मालश्री धुन सार्वजनिक याःगु खः ।                                                         नेपालभाषाया सांगीतिक ख्यलय् हे दकलय् न्हापांखुसी ‘हेभी मेटल’या म्येँ हाःगु दावी याना वयाच्वंगु ब्याण्डं थु्गुसी मोहनिया लसताय् उकथं हेभी मेटलया फ्युजनय् मालश्री धुन सार्वजनिक याःगु खः । थनिं झिंस्वदँ न्ह्यः पलिस्था जूगु ब्याण्डया ‘धम्प तछ्या.. का पासापिं धम्प तछ्या’ धाःगु म्येँ उगु इलय् तसकं लोकंह्वाःगु खः । थुगु हे ब्याण्डं आः सार्वजनिक याःगु हेभी मेटलया मालश्री धुनय् नवरस श्रेष्ठ, लसन तुलाधर व दीपेन शाक्यं गितार, प्रमोद आचार्यं बेस व इन्द्रमान महर्जनं ड्रमय् साथ बियादीगु दु ।","October 29, 2020 01:35 PM"
https://nepalbhasatimes.com/28962,न्ह्यइपुख्यः,११४० सिल्लागा एकादशी,ख्यालि न्हिली,"मरि क्यलेगु छगू अज्याःगु यन्त्र खः, गुकिं मरि ला ग्वलाना वनी, तर भाःत तप्यनी । ह्ह्ह् गुम्ह मनुखं थः कलाःया न्ह्यःने चुइँक छसः नं नवाये फइमखु …. उम्ह मनुखं बहनि ततःसलं न्ह्यः सः वयेकाः उकिया ब्वला सायेगु ज्या याइ । ह्ह्ह् यदि ज्या स्यंकेगु हे इच्छा दु धइगु खःसा अज्याःगुकथं ज्या स्यंकाबिउ ताकि मनूतय्सं व हे ज्या छिगुपाखें याकेगु ला खँ त्वःतादिसँ, छिगु बारे विचाः यायेगु तकं चाहना मयायेमा । ह्ह्ह् जिं छम्ह मिसालिसे न्ह्याबलें न्ह्याबलें न्ह्यइपुसे न्ह्यइपुसे च्वंगु जक खँ ल्हायेगु । वलिसे खँ ल्हायेबलय् जि गबलें नं तं मचाया । न्हिलाः न्हिलाः ख्याः यानाच्वनेगु । आखिरय् व मिसां जिगु लसतायात सह याये मफुत उकिं …….. वं जितः वया भाःत हे दयेकाबिल ।","February 19, 2020 06:45 AM"
https://nepalbhasatimes.com/34965,न्ह्यइपुख्यः,११४० अनलागा षष्ठी,इन्डिजिनियस टेलिभिजनय् ब्रुस लीया आत्मकथा,"येँ (नेपालभाषा टाइम्स) – नेपाःया आदिवासी समुदायया इन्डिजिनियस टेलिभिजनय् मार्शल आर्ट (कुंगफु)या विश्व चर्चित कासामि नापं नायक ब्रुस लीया धारावाहिक श्रृंखला प्रशारण जुइगु जूगु दु ।                                                         खस् नेपाली भासं प्रशारण जुइगु उगु श्रृंखला थ्व हे वइगु असोज २२ गतेनिसें विहीवाः पतिकं बहनिसिया ९निसें १० बजे तक प्रशारण जुइ । उकिया पुनः प्रशारण शनिवाः ४, आइतवाः बहनि १० व सोमवाः न्हिनय् ३ ताः इलय् जुइ । अरनिको समाजं ब्रस लीया अमरकथायात खस नेपाली भासं अनुवाद यानाः स्थानीय टेलिभिजनपाखें प्रशारण यायेत्यंगु खः । ब्रुस लीया जीवनीयात आधार दयेका प्रशारण यायेत्यंगु थ्व न्हापांगु टेलिभिजन श्रृंखला नं खः । थुग श्रृंखलाय् ब्रुस लीं थःगु ३२ दँया चिहाकःगु जीवनय् छु गज्याःगु संघर्ष यानाः विश्वय् थःत कुंगफु मार्शल आर्टया छम्ह सशक्त कासामि व कुंगफु संकिपाया नायकया रुपय् स्थापित यायेत सफल जुल धइगु प्रसंगयात न्ह्यब्वये त्यंगु दु। लिसें ब्रुस लीया व्यक्तिगत व पारिवारिक विषयय नं थुकी स्वये फइ ।","October 08, 2020 05:42 AM"
