url,category,date_published,headline,news_text,date
https://nepalbhasatimes.com/23857,न्ह्यइपुख्यः,  ,कलाकार फुटसल,"छुं ज्या यायेत स्वस्थ जुइमाः । स्वस्थ जूसा हे जक मनुखं बांलाक वा तिप्यंक ज्या यायेफइ । अस्वस्थ मनुखं याःगु ज्या नं अस्वस्थ हे जुइ । छम्ह मनू स्वस्थ जूसा ज्या नं याये फइ, बांलाक नये फइ, गनं वने फइ, म्हिते फइ, मनोरञ्जन यायेफइ । स्वस्थताया निंतिं आपालं उपाय दु । दकलय् न्हापां ला स्वस्थकर नसाज्वलं हे नयेगु यायेमाल ।                                                         उकिया नापनापं थौंकन्हय् यक्वसिनं थःगु स्वास्थ्ययात ध्यानय् तयाः मर्निङ वाक वनेगु, जीम वनेगु, स्वीमिंग यायेगु, जुम्बा, थीथी कथंया व्यायाम–कसरत, योगा आदि यायेगु यानाच्वंगु दुसा थुकिया नापनापं थौंया ल्याय्म्ह पुस्ताया दथुइ फुटसल नं छगू स्वस्थताया निंतिं लोकंह्वाःगु उपायमध्ये छगू खः । थुकथं स्वस्थताया निंतिं आपालं उपायमध्ये ‘स्वस्थ कलाकार, स्वस्थ मनोरञ्जन’ धइगु नारा बियाः वइगु साउन १८ गते शनिवाः कुन्हु स्वक्वःगु नेवाः कलाकार फुटसल कासा–११३९’ जू वनाच्वंगु दु । थुकी नेपालभाषाया म्येँ, संकिपा, टेलिप्याखं नापं खय् भाय्या संकिपाय् म्हिताच्वंपिं नेवाः कलाकारतय् सहभागिता दइ । नेपालभाषाया संकिपा निर्माणया ख्यलय् थःगु हे म्हसीका दुगु सुखावति मल्टि प्रोडक्सनया ग्वसालय् जूवनाच्वंगु थ्व फुटसल कासा थुगुसी स्वक्वःगु संस्करणयागु खः । संस्थां थ्व स्वयां न्ह्यः निक्वःतक थुकथंया फुटसल सफलतापूर्वक ग्वसाः ग्वये धुंकूगु दु । नेवाः कलाकार फुटसल कासा धाःसां नं थ्व गुगुं मेमेगु कासा गथेकि फुटबल, फुटसल, भलिबल, बास्केटबल आदि उपाधिया निंतिं प्रतिस्पर्धात्मक रुपं जुइगु कासा मखसे मात्र विशुद्ध मनोरञ्जनया निंतिं जुइगु कासा खः । न्ह्याबलें म्येँ, अभिनयपाखें न्यनामि व स्वकुमिपिंत मनोरञ्जन बीगु ज्याय् जक व्यस्त जुयाच्वनीपिं कलाकारत दछिया छन्हु जूसां थःगु निंतिं नं ई बीमाः, मनोरञ्जन यायेमाः अले उकिया निंतिं स्वयं थः हे स्वस्थ जुइमाः धइगु मान्यतां थुकथं नेवाः कलाकार दथुइ विशुद्ध मनोरञ्जनात्मक फुटसल कासा याना वयाच्वनागु प्रोडक्सनया नायःलिसें नांजाःम्ह कलाकार निर्देशक सुरेन्द्र तुलाधरं कनादिल । थ्व हे मान्यतायात आत्मसात यानाः कलाकार स्वयं थः स्वस्थ जूसा हे जक स्वस्थ मनोरञ्जन बी फइ धइगु मान्यतां थुकथं कासाया नां बियाः नेपालभाषाया सांगीतिक, संकिपा, टेलिसंकिपा, म्युजिक भिडियोया कलाकार, निर्माता, निर्देशक, प्राविधिक, च्वमिपिं दुथ्याकाः फुटसल म्हितकाः स्वयम कलाकार थःपिंसं मनोरञ्जन कायेगु अले स्वकुमिपिंत मनोरञ्जन बीगु ज्या वंगु स्वदँ न्ह्यवंनिसें याना वयाच्वनागु वय्कलं धयादिल । नेवाः कलाकार दथुइ जुइगु फुटसल कासा मात्र कलाकारया स्वस्थता व मनोरञ्जनय् जक नं सीमित जुयाच्वंगु मदु । कासाय् ब्वति कायेगु निंतिं छगू निश्चित शुल्क पुलेमाः । थ्व शुल्कय् नं छुं प्रतिशत ध्यबा संस्थापाखें चायेकातःगु नेवाः कलाकार ग्वाहालि कोषय् तयेगु यानाच्वंगु दु । थ्व स्वयां न्ह्यः निक्वःतक जूगु कासापाखें म्हःगु शुल्क कोषय् तःगु खःसा थुगुसी धाःसा ताःई न्ह्यवंनिसें म्हं मफयाच्वंम्ह नांजाःम्ह कलाकार स्वतन्त्र संसार महर्जनयात आर्थिक ग्वाहालिया निंतिं नं थ्व फुटसल जू वनाच्वंगु दु । निफ्वः स्वां संकिपापाखें अभिनय यात्रा न्ह्याकाः जिपिं बदमास मखु, अय् जि यःम्ह, इहिपा, माया, थ्व जिगु नुगः लगायत आपालं संकिपाय् थःगु अभिनय न्ह्यब्वयादीधुंकूम्ह कलाकार महर्जन थौंकन्हय् ‘स्पाइनल ट्यूमरं’ ग्रस्त जुयाच्वनादीगु दु । ५,६ दँ न्ह्यवंनिसें थुगु समस्याग्रस्त जुयाच्वनादीम्ह वय्कः दथुइ थ्व ल्वय् लने धुंकूगु खःसा आः वयाः हाकनं ल्वय् तच्वयावःगु दु । उकिं थुगुसी जुइगु फुटसल कासापाखें दुहां वःगु शुल्क मध्ये प्रत्येक कासामिपाखें ५०० तका दांया ल्याखं वय्कःयात आर्थिक ग्वाहालि याइगु जूगु दु । वइगु शनिवाः नेवाः कलाकार दथुइ फुटसल जुइगु व वयां मेगु शुक्रवाः छगू न्ह्यइपुक सांस्कृतिक ज्याझ्वः यासें कलाकार महर्जनयात आर्थिक ग्वाहालि लःल्हायेगु ज्याझ्वः दुगु प्रोडक्सनया दुजः भोगेन्द्र मानन्धरं जानकारी बियादिल । उकुन्हु नेवाः कलाकारतय् छगू सांस्कृतिक ज्याझ्वः यासें फुटसल कासाय् ब्वति काःपिं व विजयी जूपिंत लुमन्ति कथं पदक व दसिपौ लःल्हायेगु नापं कलाकार महर्जनयात नं आर्थिक ग्वाहालि लःल्हायेगु वय्कलं धयादिल । स्वक्वःगु नेवाः कलाकार फुटसल कासाय् ब्वति काइपिं कलाकारया ल्याः नं न्हापा स्वयां गाक्कं अप्वः दु । निक्वःगु संस्करणया कासा जूगु इलय् तक मिजं कलाकारपाखे च्यागू व मिसा कलाकारतय् प्यंगू पुचः दुगुलिइ थुगुसी मिजं कलाकारपाखे हे झिंनिगू पुचः दुसा मिसा कलाकारपाखे नं खुगू पुचः दु । थुगुसीया कासाया निंतिं समूह ‘क’पाखें मोहन ब्यञ्जनकार (निर्देशक), धिरेन शाक्य (मिजं कलाकार संकिपा), भीम तुलाधर (मिजं म्येँ हालामि), समूह ‘ख’पाखें उजय शाही (मिजं कलाकार संकिपा), सुरेन्द्र महर्जन (प्राविधिक), नागय डंगोल (टेलिफिल्म कलाकार), समूह ‘ग’ पाखें सुरेश प्रधान (मिजं म्येँ हालामि), पुष्पराज शाक्य, (मिजं म्येँ हालामि), अमरराज शर्मा–संगीत निर्देशक), समूह ‘घ’पाखें राजेन्द्रमान शाक्य (मिजं कलाकार व म्येँ हालामि), सलिलसुन्दर तुलाधर (मिजं मल्टि आर्टिष्ट) व संजय शर्मा राजोपाध्याय (मिजं प्याखं हुलामि)यात टीम क्याप्टेन ल्यःगु दु । मिसा कलाकार पुचलय् समूह ‘क’पाखें हिसिला महर्जन (मिसा फिल्म कलाकार), राज्यलक्ष्मी स्थापित (मिसा कलाकार टेलिफिल्म), समूह ‘ख’पाखें रचु शाक्य (मिसा हुलाप्याखं कलाकार), रुक्साना महर्जन (मिसा मोडल), समूह ‘ग’पाखें सरना श्रेष्ठ (मिसा म्येँ हालामि) व पल्पसा डंगोल (मिसा कलाकार)यात टीम क्याप्टेनकथं ल्यःगु दु । मिसातय् पुचलय् क्याप्टेननापं खुम्ह कलाकार दुथ्याकातःगु दुसा मिजं पुचलय् धाःसा खुम्हंनिसें न्हय्म्ह दुथ्याकातःगु दु ।","August 02, 2019 08:10 AM"
https://nepalbhasatimes.com/24928,न्ह्यइपुख्यः,  ,गन वन नेवाः फिल्मया हिरोइनत,"थौंकन्हय् नेवाः फिल्मया ल्याः म्हो जुयाच्वंगु दु । नकतिनि हे पिदंगु ‘हिसिमति’ धुंकाः आः लाखे भाजु, च्वापुफय, जातः, कर्म व घोषक थेंज्याःगु फिल्मया लिसें क्या फसाद व जीवनया घःचाः नांयागु फिल्म निर्माणया थीथी लँपुइ लानाच्वंगु दुसा ‘रश्मी’ नांयागु छगू फिल्म धाःसा ताःई न्ह्यवंनिसें दिनाच्वंगु दु ।                                                         आः नेवाः फिल्मया ख्यलय् चर्चा जुयाच्वं कथं निर्देशक सुरेन्द्र तुलाधरया ‘माया रत्न’ व निर्देशक सुरेश खड्गीया ‘मां’या शुटिङ्ग न्ह्याइगु खँ दु । थ्व ‘मां’ फिल्मय् रजनी खड्गी व भिन्तुना जोशीयात हिरोइनया रूपय् स्वये दइगु खँ दु । तर थौंकन्हय् भिन्तुना मय्जु नेपालं पिने च्वनाच्वंगुलिं यानाः भिन्तुनां मेगु नेवाः फिल्म म्हिती मम्हिती धइगु खँया छुं संकेत खनेमदु । नेवाः फिल्म ख्यःया छम्ह लोकंह्वाःम्ह हिरोइनया दर्जा कायेधुंकूम्ह भिन्तुना जोशी थें हे तुं आशिष्मा नकःमिया आः न्हूगु पिहां वये ल्यंदनिगु फिल्म धइगु वय्कः थःम्हेसिनं हे निर्माण याःगु ‘लाखे भाजु’ छगू खःसा मेगु धइगु निर्देशक रामकृष्ण खड्गीया बुद्ध बाखंया लिधंसाय् दयेकाच्वंगु ‘कर्म’ खः । इहिपा लिपा तिपू जीवनय् व्यस्त जुयाच्वंम्ह आशिष्माया ‘रश्मी’ छगू धाःसा गुबले पिहां वइ धइगु छुं सीमदुनि । थुलि फिल्म धुंकाः आशिष्मां थःगु पलाः न्ह्याकी धयागु थौंकन्हय् चर्चाया विषय जुयाच्वंगु दु । बलिउड कलिउडय् तकं हिरोइनतय् इहिपा लिपा पलाः तिपू जीवनपाखे हे क्वातुया वंगु यक्व दसु स्वये दु । विश्व सुन्दरी ऐश्वर्या रायया तकं अभिषेक बच्चनलिसे इहिपा धुंकाः फिल्मय् पलाः क्वातुके मफुगु खनेदुसा नेपालय् अज्याःगु दसु यक्व दु । आः वयाः नेवाः फिल्म ख्यःया खँ ल्हायेगु खःसा इहिपा लिपा तनावंपि यक्व दु । थथे इहिपा लिपा तनावंपिं हिरोइनत मध्ये छम्ह रेश्मी महर्जन खःसा मेम्ह छम्ह रेमा महर्जन खः । इपिं निम्हं ‘भिन्तुना’ फिल्मय् हिरोइन जुयाः म्हितूपिं खः । रेश्मीं इहिपा लिपा ‘तिन तिकः महाबिकः’ फिल्म म्हितलसा व धुंकाः मेगु फिल्म म्हितूगु मदुनि । थ्वहे तिनतिकः महाबिकः’ फिल्मया लुखां नेवाः फिल्मय् पलाः न्ह्याकूम्ह निक्की महर्जनया निगूगु फिल्म ‘हिसिमति’ नकतिनि हे जक पिहां वःगु दुसा आः वयात ‘च्वापुफय्’ व ‘जातः’ फिल्मय् स्वये ल्यंदनि । नेवाः फिल्मया हिरोइनतय् धमाधम इहिपा जुयाच्वंगु दु । आशिष्मा, रेश्मी, निक्की, सुमिका वज्राचार्य थेंज्याःपिं हिरोइनतय् इहिपा धुंकाः नेवाः फिल्मय् हिरोइनया अभावया सम्भावना ब्वलना वयाच्वंगु दु । थ्व निगू फिल्म धुंकाः निक्कीया पलाः गुखेपाखे स्वइ धकाः धाये थाकुनि, छाय्धाःसा वयागु नं छुं ई न्ह्य तिनि इहिपा जूगु दु । इहिपा लिपा तनावंपिं हिरोइनत मध्ये छम्ह सिन्तियासेन ताम्राकार नं खः । ‘यलय् बाथः’, ‘तुतां’ व ‘सत्य धरोधर्म’ नापं यानाः स्वंगू नेवाः फिल्म म्हितूम्ह सिन्तिया इहिपा लिपा विदेशय् वनाछ्वःगु खः । अथे हे तुं ‘जिपिं बदमाश मखु’ फिल्मया हिरोइन दीपा शाक्य नं इहिपा लिपा विदेशय् वनाछ्वःगु खः । अनं लिहां वयाः थौंकन्हय् पोखराय् तिपू जीवन हनाच्वंगु दु । ‘जिगु मिखाया न्ह्यःने’ फिल्मया हिरोइन बिनु मानन्धरं ‘ब्याहा याये म्हा’ फिल्म धुंकाः ब्याहा यानाछ्वतसा आः थौंकन्हय् तिपू जीवन हनाच्वंगु दु । नेवाः फिल्मया हिरोइनतय् धमाधम इहिपा जुयाच्वंगु दु । आशिष्मा, रेश्मी, निक्की, सुमिका वज्राचार्य थेंज्याःपिं हिरोइनतय् इहिपा धुंकाः नेवाः फिल्मय् हिरोइनया अभावया सम्भावना ब्वलना वयाच्वंगु दु । छखे थथे हिरोइनतय् इहिपा जुयाच्वंगु दुसा मेखे नेवाः फिल्मं छम्ह हिरोइनयात आर्थिक रूपं बांलाक तिबः बी फयाच्वंगु मदुगुलिं यानाः थ्व ख्यलय् पलाः क्वातुके मफयाच्वंगु दु । थौंकन्हय्या चर्चा यायेगु खःसा निर्देशक पवन जोशीया ‘बसन्त ऋतु’ फिल्म म्हितूपिं निम्ह हिरोइनत शोभा महर्जन व अन्नु महर्जनं फिल्मय् हिरोइन जुइगु सिबें मेमेगु हे ज्याय् थःगु ध्यान तयाच्वंगु खनेदु । नेवाः फिल्मया गुलिखे हिरोइनतसें थ्व ख्यलय् ताःतक पलाः क्वातुकाच्वंगु दसु उलि खनेमदु । पुलांपिं हिरोइनत मध्ये ‘राजमति’ या हिरोइन हिसिला महर्जनं न्हापा ‘चाण्डालिका’ फिल्म म्हितूगु दुसा अनं लिपा वया ‘त्याग’ व ‘कीर्तिपुर’ म्हितल । थौंकन्हय् राजमति फिल्मया हिरो मणिराज लवटलिसे तिपू जीवन हना वयाच्वंम्ह हिसिला महर्जनं नं मेगु न्हूगु नेवाः फिल्म म्हिताच्वंगु मदु । गुलिखे हिरोइनत ला छगू निगू फिल्म धुंकाः हे थ्व ख्यलं तनावंगु दसु दु । ‘मतिना सी मखु गुबलें’या हिरोइन इन्जा नेवाः लिपा वनाः ‘अंश’ फिल्मय् बःचाहाकःगु रोलय् खनेदत, अले अनंलिपा तनावन । व सिबें न्हापा ‘न्हिलाः न्हिलाः हुँ’ फिल्मय् हिरोइन जुयाः म्हितूपिं तिमिला श्रेष्ठ व रजनी शाक्यं उगु ईया छगू निगू फिल्म नं म्हितल तर अनं लिपा अनवं थनवं मदयेक तनावन । अथेहे तुं ‘निपाः ख्वाःपाः’ फिल्मया हिरोइन शबनम रन्जीत, ‘यांमिखा’ फिल्मय् म्हितूम्ह रन्जीता वज्राचार्यपिंसं नं लिपा नेवाः फिल्म म्हितूगु खने दु । उलि जक मखसे नेपाःया फिल्म ख्यःया नांजाःम्ह हिरोइन मेलिना मानन्धरं नं पटाचारा, कृषा गौतमी, धम्मवति व बांलाः मय्जु बाहेक मेगु नेवाः फिल्म म्हितूगु मदु । ‘मिजं’ फिल्मया सनी अवाले, ‘याहु’ फिल्मया रञ्जना महर्जन, ‘ह्वान्तांचा’ फिल्मया ज्ञानीशोभा महर्जन, ‘बकंफुसुलु’ फिल्मया सरिता अवाले व मीना महर्जन अले ‘गोखुन’ व ‘मतिनाया कलि’ म्हितूम्ह मधु शाही, ‘ग्वंगः क्वसः’या गंगा शाही, ‘निफ्वःस्वां’या गीता शाही, ‘सेरीव बन्जा’ या करिश्मा जोन्छे, ‘थ्व जिगु नुगः’या मल्लिका शाक्य, ‘लिधंसा’ फिल्मया दिया ग्वाछा व लक्ष्मी त्वाय्ना नं अनवं थनवं मदयेक तनावनसा आः वयाः स्वनिगः पिनें दयेकूगु न्हापांगु नेवाः फिल्म ‘लमि’या हिरोइन अन्जली महर्जनया नं छुं ई न्ह्यःतिनि इहिपा जूगु दु । थुकथं अन्जली महर्जन नं थ्व ख्यलं तापाना वनेगु लँपुइ लानाच्वंगु दु ।","September 06, 2019 08:20 AM"
