headline,final_news,date
आदर्श समाज निर्माण यायेत प्रदेश प्रहरीयात माःगु ग्वाहालि याये - प्रदेश मन्त्री डा.शाक्य,"बागमती प्रदेश प्रहरी कार्यालय हेटौंडाय् २०७८ तकया आपराधिक बस्तुस्थिति प्रतिवेदन न्ह्यगुब्वःगु दु।बागमती प्रदेश प्रहरी प्रमुख प्रहरी नायब महानिरीक्षक डिआइजी प्रकाशजगं कार्कीया नेतृत्वय् बागमती प्रदेशया एसपी नवराज अधिकारी व मेम्ह एसपी ईश्वर थापां बागमती प्रदेशया आन्तरिक मामिला तथा कानून मन्त्री डा. अजयक्रान्ति शाक्ययात उगु प्रतिवेदन लःल्हागु खः। प्रतिवेदन लःल्हाना कयादी धुंका सम्बोधन यासे मन्त्री डा शाक्यं भौतिक संरचनां सुसज्जित जुइवं जक अपराध म्हो जुइ मखु धका धयादिल । मनू तयेगु अपराध वयागु मानसिकता, व्यवहार व वातावरणय् भरपरे जुउगुलिं  मानसिक रुपं हे चेतनशील, विवेकशील, करुणा व मैत्री भावनां जालकि जक  नागरिक बांलापिं जुया वइ धका मन्त्री शाक्यं धयादिल । मन्त्री डा. शाक्यं आन्तरिक मामिला मन्त्रालयं वइगु दिनय् बजेट निर्माण याये बलय् प्रदेश प्रहरीनाप नं समन्वय यायेगु प्रतिबद्धता प्वंकादिसे अपराध न्यूनिकरण यायेत व आदर्श समाज निर्माण यायेगु सन्दर्भय् प्रदेश प्रहरीयात माःगु ग्वाहाल यायेगु जुइ धका धयादीगु दु।","  २०७८ भाद्र २८, सोमबार "
न्हूदँ राष्ट्रिय समारोह समिति ११४२ या नाय निरञ्जन रत्न शाक्य,थौं बसुवाः नेपाः ब्याङ्केटय् जूगु मुज्यां् न्हूदँ राष्ट्रिय समारोह समिति ११४२ निस्वंगु खःसा समितिया मुज्यां भाषासेवी निरञ्जन रत्न शाक्ययात सर्व सम्मतं नाय ल्यःगु दु । न्हुदँ राष्ट्रिय समारोह समिति ११४१या रमेश महर्जनया सभापतित्वय् जूगु उगु मुज्याय् समितिया आर्थिक कवःया दुजः अमृत ताम्राकारजुं वंगु दँया आर्थिक ल्याः चाः प्रस्तुत याना दीगु खः । नायः भाजु महर्जनं न्हुदँ राष्ट्रिय समारोह समिति ११४१ विघटन जूगु घोषणा याना न्हूदँ राष्ट्रिस समारोह समिति ११४२या नायःया नितिं निरञ्जन रत्न शाक्यया नां प्रस्ताव नं यानादीगु खः । न्हुदँ समारोह समिति ११४२ निस्वनेगु थुगु मुज्या रमेश महर्जनया सभापतित्वय् जूगु खःसा नेपालभाषा मंका खलःया वरिष्ठ दुजः गणेश साय्मि व नेवाः देय् दबूया नायः नरेश ताम्राकार पाहाँ कथं झायादीगु खः।,"  २०७८ आश्विन २१, बिहिबार "
भाषा आयोगयात नेपालभाषा एकेडमिया सुभाय्  ,भाषा आयोगपाखें नकतिनि नेपाल सरकारयात लःल्हाःगु प्रतिवेदनय् बागमति प्रदेशय् सरकारी ज्याखँय् औपचारिक ल्याखं छ्यलाबुला यायेगु कथं नेपालभाषा उपयुक्त धकाः गुगु खँ सिफारिश याःगु दु उकियात कयाः नेपालभाषा एकेडमिं अतिकं सकरात्मक धकाः च्वछासें आयोगया उगु प्रतिवेदनयात लसकुस याःगु दु । संघीय लोकतान्त्रिक गणतन्त्र कथं नेपाः देया शासन संरचनाय् वःगु राजनीतिक ह्यूपाःया झ्वलय् उकथं भाषिक अधिकार सुनिश्चित यायेगु कुतः जुइमाः धकाः भाषा आयोगया जिम्मेवार पदाधिकारीपिं नापं औपचारिक ल्याखं च्वनाः थुगु नेपालभाषा एकेडमिपाखें थःगु आधिकारिक धारणा न्ह्यब्वयेगु व माःगु सहलह जूगु खँ थन लुमंकाच्वना । थुगु एकेडमिं न्ह्यब्वःगु थीथी सुझावत मध्ये नेपालभाषायात प्रादेशिक सरकारया ज्याखँय् आधिकारिक छ्यलाबुलाय् हयेमा धैगु नं छता मू खँ खःसा राज्यपाखें आयोगया थुगु सुझावयात याकनं ब्यवहारय् नालेत माःगु पलाः ल्ह्वनेगु ज्या जुइ धका नेपालभाषा एकेडमिया सदस्य सचिव मल्ल के सुन्दरं भलसा दु धका धयादीगु दु । नेवाः समुदायया मांभाय् नेपालभाषा थें देय्या मेमेगु समुदायपाखें छ्यलावयाच्वंगु थीथी भाय्यात नं थीथी प्रदेशया आधिकारिक ज्याय् नालेत भाषा आयोगपाखें याःगु सिफारियात कयाः थुगु एकेडमिपाखें आपालं लसता प्वंकागु जुल धका नं सदस्य सचिव मल्लं न्ह्यथना दिल । विशेषतः नेपालभाषायात सरकारी ज्याखँय् छ्यलेगु सम्बन्धय् गुगुं नं सम्वन्धित निकाययात छुं नं कथंया ग्वहालि व सुझाव माःसा नेपालभाषा एकेडमिपाखें माःथाय् माःकथं ग्वाहालि यायेत तयार दु धका वयकलं न्ह्यथना दिल ।                                                                                                                               ,"  २०७८ भाद्र २४, बिहिबार "
बागमती प्रदेशया मुख्य मन्त्री अष्टलक्ष्मी शाक्य जुं काष्टमण्डप अवलोकन यानादील ।,२०७२ सालय् तःभुखाचं ध्वस्त जुगु काष्टमण्डप गुकथं पुन निर्माण जुया च्वन व गुलि तक पुन निर्माणया ज्या क्वचाल धका बागमती प्रदेशया मुख्य मन्त्री अष्टलक्ष्मी शाक्य झाया काष्टमण्डपया अवलोकन यानदीगु दु ।  बागमती प्रदेशया सांसद व काष्टमण्डप पुन निर्माण समितिया संयोजक राजेश शाक्यं येँ महानगर पालिकां थःगु संयोजनय् काष्टमण्डपया पुन निर्माणया ज्या जुया च्वंगु व आः तक ९६ प्रतिशत ज्या पुवने धुंकुगु जानकारी मुख्य मन्त्रीयात वियादीगु खः ।  काष्टमण्डपया अवलोकन लिपा मुख्य मन्त्री शाक्यं तःभुखाचं ध्वस्त जुगु यक्वः सम्पदा मध्ये काष्टमण्डप स्थानीय तयेगु पहलं येँ महानगर पालिकां पुन निर्माण याःगुया प्रशंसा याना दिल   । अले झीसं सम्पदा निर्माण यायेत गन नं ग्वाहाली मकासें दयेके  फु गु या थ्व छगु दसू नं जुगु धया दिल ।  ,"  २०७८ आश्विन ३१, आइतबार "
नेपालमण्डल टिभिया नायः रमेश महर्जनया निधन,"  नेवाः भाय् या छगूयां छगू जक टेलिभिजनया रुपय् नेपालया संचार जगतय् न्हाय् धस्वाकः वःगु टिभि च्यानल  नेपाल मण्डल टेलिभिजनया नायः  रमेश महर्जन थौं सोमबार आकाझाकां मन्त । ५४ दँया महर्जनयात कोरोना संक्रमण जुयाच्वंगु खःसा वय्कः निमोनिया जुयाः थौं सोमवाः मदूगु वय्कःया छेँजः स्रोतं जानकारी ब्यूगु दु ।मदुम्ह रमेश महर्जन छम्ह उद्योगपति लिसें समाजसेवी खःसा वय्कः रत्न आभूषण महासंघया नं नायः खःसा नेपाल संम्बत न्हूदँ राष्ट्रिय समारोह समिति ११४० व ११४१ या नायः नं खः । ने सं ११४० य् थ्व समितिया नायः या भाला क्वबियादीम्ह महर्जन थगुने कोरोनाया जोखिमया कारणं न्हूदँ समारोह समिति न्हूधाः मयासे ११४० यात हे निरन्तरता बिउगु खः । अथेहेतुं थगुने कोरोना जोखिमया कारणं जूगु लकडाउन धुंका मछिना च्वंगु नेपालमण्डल टेलिभिजन यात  वयकलं हाकनं बाँलाक न्ह्याकेगु योजना दयेका च्वनादीगु खः । वयकया असामयिक निधनं नेवाः सन्चारख्यलय् तच्वयेक घाःलागु दु ।अथेहे, मदुम्ह महर्जन  विवेकशील साझा पार्टीया केन्द्रीय दुजः नं खः । ","  २०७८ कार्तिक १, सोमबार "
न्हूदँ समारोहया आधिकारिक तिथिपौ पिदनीगु,"नेपाल सम्बत न्हूदँ ११४२ समारोह तःजिक हनेत लुँवह व्यवसायी भाषासेवी निरन्जन रत्न शाक्यया नायसुइ छगू समारोह समिति गठन जुइधुंकुगु दुसाः उगु हे नेपाल सम्बत न्हूदँ ११४२ समारोह समितिपाखें नेपालसम्बत या आधिकारिक तिथिपौ तयार जुल धका उगु समितिं जानकारी बिउगु दु । तिथिपौ उपसमितिया कजि देवदास मानन्धरं बियादीगु जानकारी कथं दँय् दसंथें थुगुसी नं ११४२ या तिथिपौ तयार जूगु खँ  दु । लिसें वय्कलं तिथिपौ उपसमितिया मुँज्यां तिथिपौ इनेगु नितिं समारोह समितिया दुजः उमेश स्थापित, पवित्र कसाः दुथ्याःगु इनेज्या समिति नीस्वनागु जानकारी बियादीगु दु । अथेहे, भाजु मानन्धरं नेपाल सम्बत ११०१ निसें आःतकया तिथिपौ पिथनेगु कुतः यायेगु खँ नं कनादीगु दु ।समारोह समितिं दँय् दसं न्हूदँया लसताय् येँया बसन्तपुरय् जुइगु भिन्तुना सभाय् उगु तिथिपौ उलेज्या यायेगु यानाच्वंगु खः ।","  २०७८ कार्तिक ७, आइतबार "
न्हूदँ समारोह समितिं बागमती प्रदेशया मूख्यमन्त्री  नापलात,"         नेपाल सम्बत राष्ट्रिय न्हूदँ समारोह समितिं बागमती प्रदेशया मूख्यमन्त्री राजेन्द्र पाण्डेयात नापलाःगु दु । नेपाल सम्बत न्हूदँयात कयाः थीथी कथंया सहलह ब्याकेत  बुधवाः सुथय् समारोह समितिं मुख्यमन्त्री नाप लाःगु खः ।  समितिया नायः प्रा.डा.नरेशमान बज्राचार्य लिसें सल्लाहकार समितिया संयोजक पुलांम्ह मन्त्री तीर्थराम डंगोल, बागमती प्रदेशया मन्त्री बसन्त मानन्धर लिसे  समारोह समितिया दुजःपिन्सं मुख्यमन्त्री नापलाःगु खः ।  समिति पाखें मूख्यमन्त्री पाण्डेयात नेपाल सम्बत यात कयाः प्रदेश सरकार पाखें यायेमाःगु ज्याया बारे नं छगू ध्यानाकर्षण पौं लःल्हागु खः । अथे हे वयकःयात न्हुदँया लसताय् जुइगु भिंतुना सभा व र्यालिइ ब्वति कायेत नं इनाप पौं लःल्हागु खः ।   बुधवाः हे सुथय् येँया नेपाः ब्याकेटय् स्वन्ति नखः स्वन्हू यकं हनेगु बिषलय् जुगु सहलह  ज्याझ्वलय् नेवाः तसें न्हापां निसें सुथय् क्यनाच्वंगु तिथि या अाधारय् नखः हनिगु जुउगुलिं अथे हे यायेत न इनाप यानादिल  । नायः नरेश बज्राचार्यं स्वन्ति छसिकथं हनेत इनाप यासें नखः हनेत न्हिं माः तर साइत म्वाः धइगु बिचाः तयादिगु खः ।  वयकलं भिंगु ज्या यायत व संस्कृति पर्व हनेत ब्यबहारीक कथं न्हयायेमाःगु खँय् नं बः बियादिगु खः । थुगुसिइ स्वन्ति छसिकथंकार्तिक ८ गते लक्ष्मीपूजा कार्तिक ९ गते म्हपूजा व कार्तिक १० गते किजापूजा कथं हनेत नं इनाप यानादिगु खः ।","  २०७९ कार्तिक २, बुधबार "
न्हूदँ ११४३ या लसताय् थँहितिइ तःजिक भिंतुना कालबिल ,"       येँँया थँहिति चुकय् न्हूदँ ११४३ या लसताय् तःजिक भिंतुना कालबिल कौला ज्याझ्वः जूगु दु ।  नेपाल संम्बतया न्हूदँ समारोह समिति ११४३ या थुगुसिया दकले न्हापां सभा कथं जूगु थँहिति चुकय् शुक्रवाः नेपाल संवत् न्हूदँया भिंतुना कालबिल व तुच्चा ज्याझ्वःया ग्वसाः ग्वःगु खः ।   येँ महानगरपालिकाया उपप्रमुख सुनिता डंगोललिसें थीथी पार्टीया पुलांपिं सांसदपिं, वडा नायःपिं व नेवाः न्ह्यलुवाःपिं उपस्थित जूगु उगु भिंतुना कालबिल व तुच्चा ज्याझ्वलय् सकलसित न्हूदँया भिंतुना देछासें कछलाथ्व पारु (कार्तिक ९ गते) बुधवाः येँया बसन्तपुरं जुइगु भिंतुना र्याली व भिंतुना सभाय् ब्वति कायेत समितिया नायः प्रा.डा. नरेशमान बज्राचार्यं इनाप यानादीगु खः ।  थथे भिंतुना कालबिल ज्याझ्वलय् न्हूदँ ११४२ समारोह समितिं दच्छियंकं न्ह्याकूगु ज्याझ्वःया जानकारी सफू सल्लाहकार समितिया कजि तीर्थराम डंगोल व नायः बज्राचार्यं पितब्वज्या यानादीगु खः ।","  २०७९ कार्तिक ६, आइतबार "
शताब्दि पुरुष सत्यमोहन जोशीया छेँय् संस्कृति पर्यटन मन्त्री श्रेष्ठ,"        वाङ्गमय शताब्दि पुरुष अति विशिष्ट संस्कृतिविद् सत्यमोहन जोशी दिवंगत जुउगु प्यन्हू दु खुन्हु दुखंकःपि परिवारय् विचाः हायेकेत संस्कृति पर्यटन तथा नागरीक उडयन मन्त्री जीवनराम श्रेष्ठ वयक पिनिगु छेँय् झायादीगु दु ।  विहिबार सुथय् शताब्दि पुरुष या छेँय् थ्यंकादीम्ह मन्त्री श्रेष्ठं शताब्दि पुरुष या जहान ९९ दँ दुम्ह राधादेवी जोशीयात नापलाना दिल । विचाः हायेकेगु झ्वलय् मन्त्री श्रेष्ठं शताब्दि पुरुष जोशी देशया लोक संस्कृति , साँस्कृतिक व साहित्यिक ख्यःया जक मखसे हरेक ख्यःया छम्ह  विलक्षण व्यक्तित्व खः धका धासे वयकयात सदां लुमंका तये सरकारं ल्ह्वने मागु सकतां पलाः ल्ह्वनेगु खँ कनादिल ","  २०७९ कार्तिक ३, बिहिबार "
न्हूदँ समारोह समितिं न्हूदँ नारा सार्वजनिक यात,"      नेपाल सम्बत राष्ट्रिय न्हूदँ समारोह समिति ११४३ पाखें न्हूदँ सकलसिनं तःजिक हनेगु नितिं थुगुसिया नारा सार्वजनिक याःगु दु ।  न्हूदँ समारोह समितिया सल्लाहकार समितिया कजि पुलांम्ह स्वास्थ्य राज्यमन्त्री नेवाः न्ह्यलुवाः तीर्थराम डंगोलया सभानायसुइ च्वंगु सल्लाहकार मुँज्यां थुगुसिया नं थगसनेया हे नारा ‘नेपाःया म्हसीका, नेपाःया गौरव, राज्यं हे छ्यलेमाः नेपाल संवत्’ क्वःछ्यूगु दु । समितिया सल्लाहकार कजि तीर्थराम डंगोलं दँय् दसं न्हून्हूगु नारा पितबिइगुसिबें पुलांगु हे पूमवंगु नारा पितबिइगु बांलाइगु खनेदूगुलिं वंगु दँय् पितहःगु नारायात हे थुगु दँय् नं निरन्तरता बिइगु खँया जानकारी बियादीगु दु ।  लिसें वय्कलं न्हूदँया लसताय् जुइगु सकतां कथंया भिंतुना कालबिल, ¥याली जुलुसलिसें ब्वनापौ, भिंतुना पतिइ थुगु नारा छ्यलाबुला यायेत नं इनाप यानादीगु दु ।   थुगु दँय् न्हूदँ ने.सं. ११४३ कछलाथ्व पारु (कार्तिक ९ गतें बुधवाः खःसा उगु दिं समारोह समितिं येँया बसन्तपुरं तःजिक भिंतुना जुलुस व भिंतुना सभा ज्याझ्वःया ग्वसाः ग्वयातःगु दु ।","  २०७९ कार्तिक ६, आइतबार "
