headline,final_news,date
दान्यहिरा सिरपा आःयात स्थगित जुल,नेपालभाषा एकेडेमीया ग्वसालय् दँयदं बिया वया च्वंगु दान्यहिरा सिरपा थुगुसिइ वाङमय शताब्दि पुरुष अतिकं हनेबहम्ह अति विशिष्ट संस्कृतिविद् डा सत्यमोहन जोशीया नापनापं संगीतकार मनराजा नकःमि व विज्ञान प्रविधि पाखे डा केशरी लक्ष्मी मानन्धरयात बिइगु घोषणा जुउगु खः ।  थ्वहे वइगु कौलागा चर्हे कार्तिक ६ गते बिइगु कथं ग्वसाः ग्वयातःगु खःसा नेपाःया साहित्य व संस्कृतिया ख्यलय् ज्वमदुगु योगदान दुम्ह डा जोशी  दिवंगत जुउगु दुख या थ्व इलय् आःयात नेपालभाषा एकेडेमीपाखें थ्व सिरपा ज्याझ्वः स्थगित याःगु दु ।  दिवंगत शताब्दि पुरुष जोशी  नेपालभाषा एकेडेमीया पुलांम्ह चान्सलर खः सा  उगु एकेडेमीया संरक्षक जुया  च्वना दीम्ह खः । आःयात स्थगित जुउगु थ्व दान्यहिरा सिरपा ज्याझ्वः छुं लिपा जक जुइगु खँ एकेडेमीपाखें जानकारी बिउगु दु । नेपालभाषा एकेडेमीया ग्वसालय् दँयदं बिया वया च्वंगु दान्यहिरा सिरपा थुगुसिइ वाङमय शताब्दि पुरुष अतिकं हनेबहम्ह अति विशिष्ट संस्कृतिविद् डा सत्यमोहन जोशीया नापनापं संगीतकार मनराजा नकःमि व विज्ञान प्रविधि पाखे डा केशरी लक्ष्मी मानन्धरयात बिइगु घोषणा जुउगु खः ।  थ्वहे वइगु कौलागा चर्हे कार्तिक ६ गते बिइगु कथं ग्वसाः ग्वयातःगु खःसा नेपाःया साहित्य व संस्कृतिया ख्यलय् ज्वमदुगु योगदान दुम्ह डा जोशी  दिवंगत जुउगु दुख या थ्व इलय् आःयात नेपालभाषा एकेडेमीपाखें थ्व सिरपा ज्याझ्वः स्थगित याःगु दु ।  दिवंगत शताब्दि पुरुष जोशी  नेपालभाषा एकेडेमीया पुलांम्ह चान्सलर खः सा  उगु एकेडेमीया संरक्षक जुया  च्वना दीम्ह खः । आःयात स्थगित जुउगु थ्व दान्यहिरा सिरपा ज्याझ्वः छुं लिपा जक जुइगु खँ एकेडेमीपाखें जानकारी बिउगु दु ।,"  २०७९ आश्विन ३१, सोमबार "
 पूर्व मन्त्री तिर्थ राम डंगोलया आत्म वृतान्त या पितब्वज्याया नापनापं थीथी सिरपा लःल्हात,"        नेपाली कांग्रेसया वरिष्ठ नेता पूर्व मन्त्री तिर्थ राम डंगोलं निस्वनादीगु तिर्थ तेज पुरस्कार व सम्मान शुक्रबार छगू ज्याझ्वःया दथुइ लःल्हागु दु ।  नेपाली कांग्रेसं जननायक कयातःम्ह वि पि कोइरालाया १०९ क्वःगु बुदिंया लसताय् तेज तिर्थ ट्रष्टया ग्वसालय् जुउगु उगु ज्याझ्वः तिर्थ राम डंगोलया सभानायसुइ जुउगु खः । तिर्थ तेज पुरस्कार व सम्मान ज्याझ्वलय् संघिय गणतान्त्रिक नेपालया न्हापांम्ह राष्ट्रपति डा रामवरण यादव मूपाहाँ कथं झायादीगु खः ।  ज्याझ्वलय् मानव अधिकारवादया न्ह्यलुवा पुरुषोत्तम दाहालयात छगूलख तकाया मानव अधिकार लोकतन्त्र सिरपा लःल्हागु खः । अथेहेतुं नांजाम्ह सन्चारकःमि लोकतन्त्र अभियानया न्ह्यलुवा कबिर राणा, युवा सन्चारकःमि राधिका बुढाथोकीया नापनापं नेपालभाषाया वाङ्गमय व साहित्यया ख्यलय् ज्वमदुगु योगदान बिया वया च्वंपिं  साहित्यकार प्रकाश प्रधान , भाषा संस्कृतिख्यलय् ज्वमदुगु योगदान दुम्ह अनुसन्धानविद् काशिनाथ टमोट यात नं तेज तिर्थ सिरपा लःल्हागु खः । वयकपिन्त म्हतिं न्येयद्वः न्येयद्वतका सिरपा कथं लःल्हागु खः ।  वहे ज्याझ्वलय् ग्वसाखलःया कजि पूर्व मन्त्री तिर्थ राम डंगोलया आत्मवृतान्त सफू "" नेपाली कांग्रेस र तिर्थ राम ” या पितब्वज्या नं जुउगु खः । आत्म वृतान्त सफूतिइ नेपाली कांग्रेस व थःम्हेसिनं खंगु पक्षयात गथे खः अथे च्वयागु दु धका धासे च्वमि डंगोलं अथे जुउगुलिं निष्कलङ्क जुया थःगु कार्यकाल पूवंकादीम्ह राष्ट्रपति यात छुं द्वपं मलायेमा धका कामना याना धका धयादिल । ज्याझ्वलय् मूपाहाँ नेपाःया न्हापांम्ह राष्ट्रपति डा यादवं तिर्थ राम डंगोलया इमान्दारी या तारीफ नं यानादिल । वयकलं झीगु देशं  राजतन्त्र अथें चिलावंगु मखु उकिया लिउने आपासियागु बलिदान दु धका नं धयादिल ।  ज्याझ्वलय् ज्याझ्वलय् सिरपा क्वछिना कमिटिया कवःया कजि पूर्व मन्त्र भिमसेन दास प्रधानं  सम्मानित व्यक्तित्व पिनिगु परिचय बियादीगु खःसासम्मानित व्यक्तित्वपिं पाखें पुरुषोत्तम दाहाल व काशिनाथ टमोट पिन्सं नुगःखँ तयादिलसा ज्याझ्वःया वक्ता तसें जननायक कोइरालाया साहित्यिक व राजनैतिक विषयस थःथःगु खँ तयादिल । ","  २०७९ भाद्र २४, शुक्रबार "
नेवाः देय् दबूया संरक्षक व सल्लाहकारपिन्त हन,"           नेवाः तयेगु राष्ट्रिय संगठनया रुपय् धस्वाना च्वंगु संस्था नेवाः देय् दबूपाखें छगू ज्याझ्वः याना थः सल्लाहकारपिं व संरक्षक पिन्त हनेगु ज्या  जुउगु दु । नेवाः देय् दबू या संरक्षक नेवाः न्ह्यलुवाया नापनापं नेपालभाषा एकेडेमीया भाइस चान्सलर मल्ल के सुन्दर मूपाहाँ कथं झायादीगु उगु हना ज्याझ्वः नेवाः देय् दबूया नायः पवित्र बज्राचार्यया सभानायसुइ न्ह्याःगु खः ।  बुधबार पर्यटन बोर्डया हलय् जुउगु थ्व ज्याझ्वलय् दबूया सल्लाहकारपिं निम्ह मध्ये जीवनराम श्रेष्ठ संस्कृति,पर्यटन तथा  नागरीक उड्ययन  मन्त्री व राजेन्द्र प्रसाद श्रेष्ठ संघिय मामिला तथा सामान्य प्रशासन मन्त्री नियुक्त जुया दीगुलिं वयकपिन्त भिन्तुना देछासे हनेगु ज्या जुउगु खः । उकिया नापनापं दबुया कवः नेवाः ल्याय्म्ह दबूया मूछ्यान्जे जुया च्वनादीम्ह सुनिता डंगोल मयजु येँ महानगरपालिकाया उपमेयर जुयादीगुलिं भिन्तुना देछागु खः ।  नेवाः देय् दबूपाखें थः जः दुजःपिं राज्यया नीति निर्माण तहलय् थ्यंगुलिं लसता प्वंकुसे भिन्तुना देछा या नापनापं हनेज्या याःगु खः । हना लःल्हाना काये धुंका संघिय मामिला मन्त्री राजेन्द्र प्रसाद श्रेष्ठं देश संघिय शासन प्रणालि वने धुंका शिक्षा प्रणालि नं थुकथं हे न्ह्यायेमा धका जोड बियागु खँ न्ह्यथना दिल ।  मेम्ह मन्त्री संस्कृति पर्यटन मन्त्री जीवनराम श्रेष्ठं नेपाःदेय् संस्कृति व पर्यटन क्षेत्रय् तसकं तःमिगु देश खः धका धासे विशेष याना स्वनिगः या सम्पदा धइगु नेवाः तयेगु म्हसिका खः धका धयादिल । अथेहेतुं उपमेयर डंगोलं थः पदय् दत्तले  येँ महानगरपालिका सदां नेवाः व नेवाः संस्कृति सम्पदाया पक्षय् ज्या याना च्वनि धका धयादिल ।  अथेहेतुं वंगु २०७८ चैत्र महिनाय् धरानय् जुउगु तःमुन्ज्या पाखें ल्यःज्या जुया वःगु ज्यासना पुचःया निर्णय कथं  दबूपाखें सल्लाहकार मनोनित जुयादीपिं राजेन्द्र प्रसाद श्रेष्ठ, जीवनराम श्रेष्ठ, तिर्थराम डंगोल,गीताभक्त जोशी,मुक्ति प्रधान,डा पुष्पराज राजकर्णिकार,डा महेशमान श्रेष्ठ, प्रा डा त्रिरत्न मानन्धर,त्रिरत्न शाक्य,सुवर्णकेशरी चित्रकार, दिनेश श्रेष्ठ,राजेन्द्र मल्ल पिन्त सल्लाहकार ल्यःयागु या चिं कथं पौ लःल्हागु खः सा वहे ज्याझ्वलय् संरक्षक कथं वाङमय शताब्दि पुरुष अतिकं हनेबहम्ह सत्यमोहन जोशी व दबूया निवर्तमान नायः नरेश ताम्रकार व  नेवाः न्ह्यलुवाया नापनापं नेपालभाषा एकेडेमीया भाइस चान्सलर मल्ल के सुन्दर पिन्त वयक पिनिगु मनोनयन पौ लःल्हागु खः ।","  २०७९ भाद्र ८, बुधबार "
न्हूदँ  तःजिक हनेत  न्हूदँ समारोह समितिया इनाप,         नेपाल सम्बत राष्ट्रिय न्हूदँ समारोह समिति ११४३ या नायः प्रा.डा. नरेशमान बज्राचार्यं वाङ्गमय शताब्दि पुरुष अति विशिष्ट संस्कृतिविद् सत्यमोहन जोशी दिवंगत जुउगु कारणं थुगुसिइ न्हूदँ हनेगु  जुइमखु धका हल्ला जुया च्वंगुया लिसः कथं मंगलवाः सुथय् छगू विज्ञप्ति पितब्यूसे  न्हूदँ महनेगु छुं ग्वसाः मदुगु जानकारी बिसे थुगुसीया न्हूदँ सदां थेंहे हनेत सकलसित इनाप यानादीगु दु । वय्कलं न्हूदँया तयारीया नितिं समारोह समितिं थीथी ज्या न्ह्याकावयाच्वंगु जानकारी न बियादिल ।  वयकलं न्हूदँ राष्ट्रिय पर्व जक मजुसे नेपाःया संस्कृति जूगुलिं न्हूदँ व थ्वलिसे स्वाःगु स्वन्ति नखः स्वन्हुयंकं झ्वःलाक्क हनेत नं इनाप यानादीगु दु ।  लिसें भाजु बज्राचार्यं उगु विज्ञप्तिपाखें सकलसित मदुम्ह वाङ्मय शताब्दी पुरुष संस्कृतिविद् युगपुरुष सत्यमोहन जोशी मदुगु दुःखयात थ्व दँय् शक्ति कथं न्ह्यःने यंकाः न्हूदँ ज्याझ्वः न्हापालिपासिबें जनचेतना थनेगु कथं व नेपाःया मौलिक राष्ट्रिय सम्बत नेपाल सम्बत हलिंन्यंकं च्वनाच्वंपिं नेपाःमिपिन्त भिंतुना बिइगु कथं व नेपाल सम्बत राष्ट्रिय सम्बत धायेधुंकाः सरकारपाखें यायेमाःगु ज्या याकेगु नितिं दबाब बिइगु कथंया ज्याझ्वः यायेत नं इनाप यानादीगु दु ।,"  २०७९ कार्तिक १, मंगलबार "
नेपालभाषा व तामाङ भाषायात बागमति प्रदेशया सरकारी कामकाजि भाषा याइगु,"    नेपाल सरकारं गठन यानातःगु भाषा आयोगया सिफारिस कथं नेपालभाषा व तामाङ भाषायात बागमति प्रदेशया सरकारी कामकाजि भाषाया रुपय् लागू यायेगु नितिं बागमति प्रदेशया सोमवा: च्वंगु मन्त्रिपरिषदया मुँज्यां स्वम्ह सदस्यया कार्यदल नीस्वनेगु निर्णय या:गु दु ।  भाषा आयोगया सिफारिस कथं ज्या न्ह्याकेत बागमति प्रदेशया राजधानी हेटौंडाय् च्वंगु मन्त्री परिषदया मुँज्यां उगु कथं खँ क्व:छिउगु ख: । कार्यदलय् औपचारिक रुपं सु सु च्वनादीगु दु धइगु खँ मंगलवा: तकया दुने सार्वजनिक याइ धका: धा:गु दु ।  नेवा: देय् दबू स्वनिग: विशेष प्रदेश, नेपाल तामाङ घेदुङया बागमति प्रदेश व नेवा: देय् दबूयाया बागमति प्रदेश समितिपाखें मदिक्क थुगु मुद्दायात ल्ह्वना दबावमुलकनिसें थीथी ज्याझ्व: याना वयाच्वंगु ख: ।  मुख्य मन्त्री राजेन्द्र प्रसाद पाण्डें छुं दिं न्ह्य: बियादीगु बचं कथं हे आ: कार्यदल दयेकेगु ज्या यानादीगु धैगु तसकं बांलात धका: नेवा: देय् दबू स्वनिग: विशेष प्रदेशया नायः श्रीकृष्ण महर्जनं धयादीगु दु । आ: नेपालभाषा व तामाङ भाषायात कामाजि भाषाया रुपय् लागू याकेगु नितिं नं नेवा: व तामाङत मदिक्क जाना वनेमा:गु अवस्था दु धका: नं वयकलं धयादीगु दु ।     नेपाल सरकारं गठन यानातःगु भाषा आयोगया सिफारिस कथं नेपालभाषा व तामाङ भाषायात बागमति प्रदेशया सरकारी कामकाजि भाषाया रुपय् लागू यायेगु नितिं बागमति प्रदेशया सोमवा: च्वंगु मन्त्रिपरिषदया मुँज्यां स्वम्ह सदस्यया कार्यदल नीस्वनेगु निर्णय या:गु दु ।  भाषा आयोगया सिफारिस कथं ज्या न्ह्याकेत बागमति प्रदेशया राजधानी हेटौंडाय् च्वंगु मन्त्री परिषदया मुँज्यां उगु कथं खँ क्व:छिउगु ख: । कार्यदलय् औपचारिक रुपं सु सु च्वनादीगु दु धइगु खँ मंगलवा: तकया दुने सार्वजनिक याइ धका: धा:गु दु ।  नेवा: देय् दबू स्वनिग: विशेष प्रदेश, नेपाल तामाङ घेदुङया बागमति प्रदेश व नेवा: देय् दबूयाया बागमति प्रदेश समितिपाखें मदिक्क थुगु मुद्दायात ल्ह्वना दबावमुलकनिसें थीथी ज्याझ्व: याना वयाच्वंगु ख: ।  मुख्य मन्त्री राजेन्द्र प्रसाद पाण्डें छुं दिं न्ह्य: बियादीगु बचं कथं हे आ: कार्यदल दयेकेगु ज्या यानादीगु धैगु तसकं बांलात धका: नेवा: देय् दबू स्वनिग: विशेष प्रदेशया नायः श्रीकृष्ण महर्जनं धयादीगु दु । आ: नेपालभाषा व तामाङ भाषायात कामाजि भाषाया रुपय् लागू याकेगु नितिं नं नेवा: व तामाङत मदिक्क जाना वनेमा:गु अवस्था दु धका: नं वयकलं धयादीगु दु ।","  २०७९ भाद्र २८, मंगलबार "
