headline,final_news,date
थःम्हं यानागु योगदानयात लुमंकाः थःत भोट बिइधइगु भलसा कयाच्वंम्ह शैलेश लगंबरे,"         प्रतिनिधि व प्रदेशसभाया चुनावय् बागमती प्रदेशपाखें स्वतन्त्र उम्मेदवार कथं तुतां चिं कयाः उम्मेदवारी ब्यूम्ह शैलेश शाक्य लगंबरें थःपिं चुनावय् त्याइगुखँय् धुक्क जूगु खँ कनादीगु ।  भाजु लगंबरें थःपिं जनतां ल्ह्वनीगु सकतां मुद्दाय् ताःई न्ह्यःनिसें छम्ह अभियन्ता कथं न्ह्यज्यानाः वया च्वनागु खँ कनादिसें वय्कलं थः न्हापांनिसें कांग्रेस पार्टीइ सकृयम्ह खःसां उगु पार्टिइ थःपिं नेवाः जुयाः ज्या यायेगु स्थिति मखनेवं पार्टी परित्याग यानाः स्वतन्त्र राजनीति यानाच्वनागु खँ नं कनादीगु दु ।  येँया ९ नम्बर क्षेत्र ‘क’पाखें उम्मेदवारी बियादीम्ह लगंबरे नेवाः आन्दोलनया छम्ह सकृयम्ह कार्यकर्ताया  लिसें गुथि विधेयकया आन्दोलन, संस्कृति सम्पदा आन्दोलनया सक्रिय व्यक्तित्व नं खः । ९ नम्बर प्रदेशसभा ‘क’या वडा नेवाः बाहुल्यता दूगु १२, २१, २२ वडा लाःसा १४ वडा नं लानाच्वंगु दु ।  उम्मेदवार लगंबरें थःपिं २०३७ सालनिसें राजनीतिक आन्दोलनय् सक्रिय जुयाच्वनागु व २०४३ सालनिसें भाषा आन्दोलनय् दूगु खँ कनादिसें मतदातापिन्सं थःम्हं यानागु योगदानयात लुमंकाः थःत भोट बिइधइगु भलसा कयादीगु दु ।","  २०७९ कार्तिक २८, सोमबार "
भाषा आयोगया सिफारिसयात कार्यान्वयन यायेगु बचं बिउम्ह राजेश शाक्य,"        प्रतिनिधि सभा व प्रदेश सभाया चुनावया निंतिं येँया ८ नम्बर क्षेत्र प्रदेश ‘क’पाखें नेकपा एमालेया उम्मेदवार जुयादीम्ह राजेश शाक्यं थःपिं त्यात धाःसा बागमती प्रदेशया भाषा, जाति, संस्कृतिलिसें जनजिविकाया सवालय् ज्या यायेगु खँया बचं बियादीगु दु ।  वय्कलं ८ नम्बर प्रदेश ‘क’पाखें थःपिनिगु निक्वःगु उम्मेदवारी जूगु धासें न्हापांगु न्यादँया कार्यकालय् थःपिन्सं यानागु ज्याया मूल्यांकन यानाः जनतां थ्वपालय् नं थःत त्याकीगु भलसा कयादीगु दु ।  भाजु शाक्यं थःपिनिगु उम्मेदवारी विशेष रुपं भाषा आयोगया रिपोर्टयात कार्यान्वयन यायेगु, येँया बहिद्यः चाःहिलेगु लँपुयात सम्पदा मार्ग व पर्यटकीय मार्ग कथं विकास यायेगु लिसें नेवाःतय्गु मौलिक लजगायात थपु यायेगु, उपत्यकास्तरीय गुथि विधेयक निर्माण यायेगु अथेहे, येँ दुनेया सहरयात परम्परागत  साँस्कृतिक सहर heritage city कथं दयेकेगु अवधारणा प्रदेशसभाय् यंकेगु ग्वसाः दूगु खँ कनादीगु दु । भाजु शाक्य नेवाःतय्गु थीथी ख्यलय् च्वनाः ज्या यानाः वयाच्वंम्ह व्यक्ति खःसा वय्कलं नेवाः देय् दबू विशेष प्रदेश समितिं थःत लःल्हाःगु  नेवाः मुद्दा या ध्यानाकर्षण पतिइ थःपिनिगु पूर्ण रुपं प्रतिबद्धता दूगु खँ नं कनादीगु दु ।","  २०७९ कार्तिक २९, मंगलबार "
 भोट फ्वंवःपिंन्त  जनतां नेवाः मुद्दाया पौ लःल्हात,         प्रतिनिधि सभा व प्रदेश सभाया चुनावया दिं न्ह्यनेवयाच्वंगु थ्व इलय् भोट फ्वंवःपिं उम्मेदवार तयेगु ल्हातिइ जनतां नेवाः मुद्दा सहितया पौ लःल्हायेगु अभियानयात तच्वयेकुगु दु ।  थ्वहे झ्वलय् नेवाः अभियन्ता  गंगाबहादुर नेमकुलं बागमति प्रदेशया लागिं उम्मेदवार जुयादीपिन्त सोमबार झिंस्वंगु( १३ ) बुँदाया नेवाः साझा मुद्दाया पौ लःल्हाना दिल ।  ललितपुर क्षेत्र २ या गठबन्धन उम्मेदबार पिन्त भिन्तुना देछासे वयकलं  नेवाःतयेगु साझा मुद्दाया पौ लःल्हानादिइगु खः ।  ललितपुर निर्वाचन क्षेत्र नं. २ क या निंतिं बागमति प्रदेशया लागि गठबन्धन उम्मेदवार  रेसा श्रेष्ठ मयजु यात थथे पौ लःल्हाना दीगु खः ।  पौ लःल्हाना काये धुंका उम्मेदवार मयजु रेसा श्रेष्ठं थः नं छम्ह नेवाः जुगुलिं नेवाः मुद्दा प्रति सदां नुगः क्वसायेका च्वनेगु बचं बियादिल । थ्व अभियान या शुरुअात  नेवाः देय् दबू स्वनिगः विशेष प्रदेश पाखें न्ह्याकुगु खःसा नेवाः अभियन्ता श्रीकृष्ण महर्जनं उम्मेदवार  भोट फ्वंवइगु इलय् नेवाः मुद्दा सहितया पौ लःल्हायेत इनाप यानादीगु खः ।,"  २०७९ कार्तिक २९, मंगलबार "
लोकतान्त्रिक बामगठबन्धनया सकल उम्मेदवार तयेत  त्याकेत काठमाडौं ९ या  उम्मेदवार कल्पना धमलाया इनाप ,         येेँया २१ वडा स्थित लगंत्वालय् जूगु लोकतान्त्रिक वामगठबन्धन बिशाल सभाय् काठमाडौं क्षेत्र  ९ या प्रदेश सभा सदस्य (क)  उम्मेदवार नानू बास्तोलां थः थ्व   बिजयी  जुल धाःसा  २१ वडाया जनतां थौंकन्हे भोगेयाना च्वनेमाःगु लः या समस्या व लँ या समस्या समाधान यायेगु हे पहिलो प्राथमिकताय् तया प्रदेश बजेटपाखें थ्व समस्या समाधान यायेगु बचं बियादिल ।  अथेहेतुं वयकलं  साँस्कृतिक स्वायत्तता व पर्यटन  क्षेत्रयन   बिकासया निंतिं पलाः न्ह्याकेगु प्रतिबद्धता प्वंकादिल  । आः जुइगु निर्वाचनय् प्रतिनिधि सभा  सदस्य उम्मेदवार लोकतान्त्रिक बामगठबन्धन काठमाडौं ९ या कल्पना धमलां काठमाडौं ९ दुने विद्यमान लः व लँया समस्या ज्यंकेत काठमाडौ ९ दुने हे दुउगु लःया स्रोत ज्याख्यले हया समस्या  समाधान याये कथं अध्ययन जुयाच्वंगु दु धका धासे  मेलम्ची लः या विकल्पया रुपय् काठमाडौं ९ दुने दुउगु लः या स्रोत छ्यलेगु जुइ धका धयादिल ।  थुग चुनाव त्यात धाःसा भोट बियादीपिं जनतायात छु नं हालतय् निरासा लुइके बिइमखु मखु धका धासे काठमाडौं ९ या जनताया छ्यँ धस्वाकेत काठमाडौंया साँस्कृतिक क्षेत्र बिकास याना पर्यटन व्यवसायया बिकास यायेगु खँ नं  लोकतान्त्रिक वामगठबन्धनया उम्मेदवार पिन्सं खँ न्ह्यने हःगु दु । नापनापं युवा वर्गयात ज्या बिया रोजगार ब्यबस्थापन याये धका धागु दु ।  गठबन्धन या प्रतिपक्षपाखें यदि जनताया मेहनत व बलिदानं प्राप्त  जुउगु संविधान या उपलब्धियात खतरा जुल धासा लोकतान्त्रिक बामगठबन्धनं नेपालया संविधानया रक्षा यायेगु ज्या जुइ धका धासे  काठमाडौंया जनतायात लोकतान्त्रिक बामगठबन्धनया सकल उम्मेदवार तयेत अत्याधिक भोट बिया त्याकेत काठमाडौं ९ या प्रतिनिधि सभा उम्मेदवार कल्पना धमलां इनाप यानादिल ।,"  २०७९ मङ्सिर १, बिहिबार "
राष्ट्रपति भण्डारीं भाषाथुवा बज्राचार्ययात  सत्यमोहन नेपालभाषा साहित्य सिरपा लःल्हात,"राष्ट्रपतिं विद्या देवी भण्डारीं नेवाः भाय् व नेवाः तजिलजि या बिस्कं महत्व दु धका धयादिसे रन्जना लिपि धइगु देय्या मौलिक लिपि खः धका धयादीगु दु । राष्ट्रपति भण्डारीं राष्ट्रपति भवन शितल निवासय् बुधबार जुउगु तःजिगु छगू ज्याझ्वःया दथुइ  भाषाथुवा फणिन्द्ररत्न बज्राचार्ययात सत्यमोहन जोशी नेपालभाषा साहित्य सिरपा देछायेगु ज्याझ्वलय् थः नुगःखँ तयेगु झ्वलय् थथे धयादीगु खः ।  नेपालभाषा मंका खलः यलया ग्वसालय् जुउगु उगु ज्याझ्वः ग्वसाखलःया नायः हिराकाजी महर्जनया सभानायसुइ न्ह्यागु खः । राष्ट्रपति भण्डारीं त्वादेवाय् मत च्याका उलेज्या यानादीगु उगु ज्याझ्वलय् मंका खल यलया छ्यान्जे महेन्द्र महर्जनं लसकुस यानादीगु खः ।  ज्याझ्वलय् सिरपा शिफारिश पुचःया कजि नेवाः न्ह्यलुवा वरिष्ठ साहित्यकार डा पुष्पराज राजकर्णिकारं फणिन्द्ररत्न बज्राचार्य धइम्ह भाषाख्यलय ज्वमदुगु योगदान दुम्ह व्यक्तित्व खः धका धासे वयकलं नेपालभाषा परिषदया नायः या  ताः ईतक तक यानादीगु योगदानया चर्चा यानादिल ।  ज्याझ्वलय् विशेष पाहाँ यल महानगरपालिकाया मेयर चिरिबाबु महर्जनं वाङमय शताब्दि पुरुष सत्यमोहन जोशीया गुणयात लुमंका दिलसा वयकया""चारुमति” नांयागु छगू प्याखं क्यनेगु इच्छा थः मेयर जुया च्वनागु थ्व इलय् न्ह्याथे यानासां पूवंके धका प्रतिबद्धता प्वंकादिल । उगु हे ज्याझ्वलय् नेपालभाषा मंका खलः यलया ग्वसालय् जूगु चेस कासाय् सिरपा त्याकुपिन्त राष्ट्रपति भण्डारी पाखें सिरपा न लःल्हागु खः ।  ज्याझ्वलय् सत्यमोहन जोशी नेपालभाषा साहित्य सिरपा निस्वनेत आर्थिक ग्वाहालि यानादीपिंन्त नं हनापौ देछागु खः । उगु हे ज्याझ्वलय् राष्ट्रपति भण्डारी पाखें  नेपालभाषा मंका खलः यलया संस्थापक नायः छत्र बहादुर कायस्थयात नं हनापौ देछाना दीगु खःसा भाषासेवी मोतिलाल शिल्पकार व पुलांम्ह मन्त्री बुद्धिराज बज्राचार्य यात मंका खलः यलया मानार्थ दुजः या पौ नं लःल्हाना दीगु खः ।","  २०७९ मङ्सिर २१, बुधबार "
लोक साहित्य व संस्कृतिलागाय् ज्वमदुम्ह खः सत्यमोहन जोशीः प्रधानमन्त्री देउवा,"       नेपालभाषा मंकाः खलः यलया ग्वसालय्  शुक्रवाः यलया मंगलबजारय् वाङ्‍मय शताब्दी पुरुष सत्यमोहन जोशी मदुगु झिंस्वन्हूया पुण्य तिथिसं बिचाः मुज्या ज्याझ्वः याःगु दु ।  उगु बिचाः मुंज्याय् प्रधानमन्त्री शेरबहादुर देउवां वाङ्‍मय शताब्दी पुरुष सत्यमोहन जोशी देय्या भाषा, कला , लोक साहित्य व संस्कृतिया लागाय् ज्वमदुम्ह सुनां भ्वय् मफइम्ह व्यक्तित्व खः धइगु बिचाः प्वंकादिल ।  प्रधानमन्त्री देउवां शताब्दी पुरुष जोशी सरल जीवनया पर्याय जुगु व नेपाल  चीनया सांस्कृतिक सम्बन्ध स्थापित यायेत महत्वपूर्ण भूमिका म्हितादिम्ह व्यक्तित्व जुगु बिचाः प्वंकादिगु खः ।  प्रधानमन्त्री देउवा शुक्रबार हे सत्यमोहन जोशी लोक साहित्य भवन झाया अन संग्रहित सामग्री अवलोकन यानादिल ।  संस्कृति, पर्यटन व नागरिक उड्डयनमन्त्री जीवनराम श्रेष्ठ जोशी थेजाम्ह विद्वान व्यक्तित्व संसारय् म्हो जक जन्मे जुइगु धासे वयकः बहुगुण सम्पन्न व्यक्तित्व, विज्ञ व देशया साहित्य व संस्कृति न्ह्यब्वयेगु ज्याय्  अतुलनीय व अविस्मरणीय ज्या याःगु बिचाः तयादिगु खः ।  यल महानगरपालिकाया मेयर चिरिबाबु महर्जनं जोशीया निधनं इतिहासया छगू अध्यायया अन्त जुल धका धयादिल ।  सत्यमोहन जोशया माहिलाम्ह काय्  अनुराज जोशीं थः अबु शताब्दी पुरुषया सम्मानय् स्वंगु कथंया मुद्रा र हुलाक टिकट पिकानाः राज्यं विशिष्ट सम्मान याःगु धासें वयकः मदुगु शोकय् बिदा घोषणा यागु धइगु नं तःधंगु खँ  खः धयादिल ।  नेपालभाषा मंका खलः यलया नायः हीराकाजी महर्जनं सत्यमोहन जोशीया राष्ट्रिय व्यक्तित्वयात अजर अमर यायेगु आजु तयाः सत्यमोहन जोशी भाषा साहित्य पुरस्कार स्थापना यानाःगु जानकारी  बियादिसे भाषा साहित्यया विकासय् ग्वाहालि यायेगु नितिं आःया नितिं न्येयछद्वः तकाया पुरस्कार कोष स्थापना यानाःगु खँ नं कनादिल ।","  २०७९ कार्तिक १२, शनिबार "
