headline,final_news,date
पत्रकार महासंघया संस्थापक अध्यक्ष कृष्णप्रसाद मखु धइगु खँयात कया सहलह,नेपाल सरकारं नीति तथा कार्यक्रमय् आमसंचार प्रशिक्षण प्रतिष्ठान गठनय् कृष्णप्रसाद भट्टराईया नां स्वाकाः हःगु व थुकिं नेपाल पत्रकार महासंघया संस्थापक अध्यक्ष सत्यनारायण बहादुर श्रेष्ठया योगदानप्रति बेवास्ता याःगुली ध्यानाकर्षण यासें  ज्याझ्वलय् नेवाः पत्रकार राष्ट्रिय दबूया नायः सुरजबीर बज्राचार्यं सत्यनारायण बहादुर श्रेष्ठ या १०५ क्वःगु जन्मजयन्तीइ संचार मन्त्री पार्वत गुरुङया मूपाहांकथं उपस्थिति दुगु खःसा १०६ क्वःगु जन्मजयन्ती ला  पत्रकार महासंघया हे हलय् महासंघया हे ग्वाहालिइ जूगु खः तर सहभागिता धाःसा महासंघपाखें मजुगु खःसा उगु खँय् जानकारी हे मदु धायेगु गुलि गैरजिम्मेवारी खँ जुइ धकाः धयादिसेँ गुलि नं तथ्य थीथी माध्यमं वयाच्वंगु दु उकियात बेवास्ता यानाः हाकनं अध्ययन यायेगु धकाः वःगु खँया नं विरोध यानादिल । अध्ययन हे यायेमाः थें ताःसा पुलांगु तथ्यया आधार त्वःते मज्यूगु खँय् बज्राचार्यं बः बियादीगु खः । ज्याझ्वलय् पत्रकार दबूया मूछ्याञ्जे सुनील महर्जनं न्हापा थःपिन्सं पत्रकार महासंघया अध्यक्षपिन्त थुगु विषय ज्ञापनपत्र मार्फत दबुलिं ध्यानाकर्षण याकाः वयाच्वनागु खँ न्ह्यथनादिल । थुगु अन्तरक्रियाय् सत्यनारायण बहादुर श्रेष्ठया योगदानया उल्लेख व कदरया नितिं न्ह्यात्थेंजाःगु पलाः छीमाःसा छीगु निष्कर्षलिसें सम्बन्धित थासय् ज्ञापन पत्र बीगुनिसें कडा आन्दोलनय् वनेमाःसा वनेगु धइगु सहलह फोनिज दुने जूगु खँ नं न्ह्यथने बहःजू । Reply Forward,"  २०७९ आषाढ ३, शुक्रबार "
नेवाः ज्ञानकोषयात कयाः नेपालभाषा एकेडेमिइ  सहलह  ,"   नेपालभाषा एकेदेमिया ग्वसालय् नेवाःतय्गु सकतां खँ दुथ्याका ज्ञानकोश दयकेगु ज्या न्ह्यानाच्वंगु दुसाः नेवाःतसें न्ह्याका वयाच्वंगु थःगु मौलिकतायात कःघाना नेवाःतय्गु विशेषतायात उजागर याय्भनं उकिया जानकारी सकसितं बियेफयमा धैगु खँयात ध्यान तया थुगु ज्ञानकोण दयकेत थीथी नेपालभाषाया थीथी पक्षय् सःस्यूपिं च्वमिपिन्त थीथी कथंया विषयया भाला बिया ज्या न्ह्याका वयाच्वंगु खँ एकेडेमीया सदस्य सचिव डा पुष्पराज राजकर्णिकारं धयादीगु दु ।   थ्व हे झ्वलय्  किपूया नेपालाभाषा एकेडेमीया हलय्  शनिवार  छगू सहलह  मुन्ज्या जूगु दु । उगु सहलह मुन्ज्याय् विज्ञपिं योगेन्द्र प्रधान व सौभाग्य प्रधानांगपिन्सं ज्ञानकोषया रचनाया विषयलय् थःथःगु सुझाव बियादीगु खः ।  विज्ञपिं डा. योगेन्द्र प्रधानजु्ं नेपालभाषा प्राचीन काव्य व व्यक्तित्वयात कया व सौभाग्य प्रधानांगं सांस्कृतिक पक्षयात कया खँ कनादीगु खः । व्यक्तित्व म्हसिकाय् संस्कृति, भाषा, कला, इतिहास निर्माण, साहित्य, संगीत, समाजसेवा, शिक्षा आदि ख्यलय् विशिष्ट योगदान बियादीपिं व्यक्तित्वपिन्त म्हसिकेगुकथं ज्या जुयावयाच्वंगु दु ।  नेवाः ज्ञानकोषय् थीथी विषयवस्तुयात कःघाना मू विषय, कचा विषय व तँसा विषय याना स्वंगू ब्वय् ब्वथला दुथ्याकेगु ज्या जुयाच्वंगु दु धका धयादिसे  थ्व ज्ञानकोशया ज्या न्ह्याना च्वंगु स्वदँ वयेधुंकुगु व अाः दच्छिया दुने थ्व ज्या पुवनिगु खँ एकेडेमीया भाइस चान्सलर मल्ल के सुन्दरं कनादिल  ।  अनिलरत्न स्थापितं न्ह्याकादीगु सहलह मुन्ज्याय् नेपालभाषा एकेदेमिया भाइस चान्सलर मल्ल के सुन्दर, सदस्य सचिव डा पुष्षराज राजभण्डारी, डा.चुन्दा बज्राचार्यजु्पिन्सं नं ज्ञानकोषया आभारभूत खँ कनादीगु खः । सहलह ज्याझ्वलय् थीथी व्यत्तित्वपिं प्रा. प्रेमशान्ति तुलाधर, डा. बज्रमुनि बज्राचार्य, मुनिन्द्ररत्न बज्राचार्य, त्रिरत्न मानन्धर लगायतपिन्सं थीथी खँ न्ह्यब्वया दीगु खः । ","  २०७९ आषाढ ५, आइतबार "
क्रोधकला शिरोमणि कालु कमालेया डकुमेण्ट्री पितब्वज्याय् जनप्रतिनिधिपिन्त भिन्तुना ,       क्रोधकला शिरोमणि धका हस्तकला ख्यलय् नांजाम्ह प्राज्ञ  कालु कमालेया डकुमेण्ट्री पितब्वज्याय् यलय् थुगुसिइ निर्वाचित जुयादीपिं जनप्रतिनिधिपिन्त भिन्तुना देछागु दु ।  क्रोधकला शिरोमणि कालु कमालेपाखें  जनप्रतिनिधिपिन्त भिन्तुना  देछागु ज्याझ्वलय् बागमति प्रदेशया सांसद शोभा शाक्य व नेपाल ललित कला प्रज्ञा प्रतिष्ठानया कुलपति के के कर्माचार्यया विशेष उपस्थिति दूगु खः । ज्याझ्वलय् क्रोधकला शिरोमणि कुमाले भाजुं यलया नव निर्वाचित मेयर चिरिबाबु महर्जनया नापनापं यलया दक्व वडाया वडानायः व यल महानगरपालिका या कार्यपालिका दुजः पिन्त खादाँ क्वखाएका भिन्तुना देछाना दीगु खः।  थ्वहे ज्याझ्वलय् क्रोधकला शिरोमणि कालु कमालेया आधिकारिक वेबपेज नं सार्वजनिक याःगु खःसा उकिया नापनापं वयकया डकुमेण्ट्री पितब्वज्या नं जूगु खः।  कुमार यात्रुं च्वयादीगु थ्व डकुमेण्ट्रीया अवधारणाव सम्पादन नवराज लामां यानादीगु खः । थुगु डकुमेण्ट्री कालु कुमालेया आधिकारिक वेब साइट या नापनापं युट्युब य् तयातःगु दु ।  ज्याझ्वलय् क्रोधकला शिरोमणि कालु कमाले फाउण्डेशनया राकेश अवालें लसकुस न्वचुतसे फाउण्डेशन व थः अबुजु क्रोधकला शिरोमणि कालु कमालेया बारे खँ तयादिल । ज्याझ्वलय् यल महानगरपालिकाया मेयर चिरिबाबु महर्जनं यलय् कालु कुमाले थेंजाम्ह क्रोधकला शिरोमणि दुगु धइगु गौरवया खँ खः धका धयादिसे वयकया सम्मानय् महानगरपालिका पाखें छगू विशेष कथंया पलाः ल्ह्वनेगु योजना दुउगु खँ नं कनादिल ।,"  २०७९ आषाढ ७, मंगलबार "
 पद्मरत्नया जहान मंगलवाः लुतिइ अन्त्येष्टि याइगु,   नेवाः न्ह्यलुवा लिसें वरिष्ठ मानव अधिकारवादी नेता पद्मरत्न तुलाधरया जहान नीलशोभा तुलाधर  सोमवाः बहनी ९ बजे वय्कः आकाझाकां मदुगु खः । मदुम्ह तुलाधर ७८ दँ दुम्ह खः ।  येँया असं त्वालय् जन्म जुयादीम्ह मय्जु तुलाधर १४ दँ जक दुबलय् १८ दँ दुम्ह पद्मरत्न तुलाधरलिसे इहिपा जूगु खः । मदुम्ह तुलाधरया कायभाजु श्रवन तुलाधरं  कनादीकथं सोमवाः थःगु हे छेँय् द्यनाच्वंम्ह वय्कःयात आकाझाकां हृदयाघात जूगु खः । हृदयाघात जूगुयां १५ मिनेटं हे वय्कः मदुगु खः । अस्पताल यंकूबलय् वय्कः मदयेधुंकूगु खँ चिकित्सकतय्सं धाःगु खः । आः मंगलवाः हे वय्कःया अन्त्येष्टि याइगु खँ छेँजःपिंसं धाःगु दु ।  वय्कःया सीम्हयात अस्पतालं तप्यंक लुतिइ यंकेगु ग्वसाः जुयाच्वंगु दु । लुतिइ सिथं यंकीबलय् ११–१२ बजे जुइफुगु खँ नं छेँजःपिंसं जानकारी बिउगु दु ,"  २०७९ आषाढ २१, मंगलबार "
संस्कृति पर्यटन तथा नागरिक उड्डयन मन्त्रीन्त्रीयात जागरण मन्चं ज्ञापनपौ लःल्हात," नेवाः जागरण मन्चया ग्वसालय्   संस्कृति पर्यटन तथा नागरिक उड्डयन मन्त्री जीवनराम श्रेष्ठयात वयक मन्त्री पदय् नियुक्त जुयादीगुलिं छगु भिन्तुना ज्याझ्वः याःगु दु । उगु ज्याझ्वलय् नेवाः जागरण मन्चया नायः सुजिब बज्राचार्यं नेवाः सरोकार व संस्कृति पर्यटन तथा नागरिक उड्डयन मन्त्रालय पाखें यायेमाःगु ज्यायात कया छगु ज्ञापनपौ नं लःल्हागु दु । जागरण मन्चया नायः सुजिब बज्राचार्यया नायसुइ न्ह्याःगु उगु ज्याझ्वलय् ग्वसाखलःया मूछ्यान्जे विजयकृष्ण श्रेष्ठं लसकुस न्वचु तयादीगु खः । ज्याझ्वलय् नेपालभाषा मंका खलःया नायः जनकवि दुर्गालाल श्रेष्ठ विशेष पाहाँ कथं झायादीगु खः । उगु नव नियुक्त मन्त्री जीवनराम श्रेष्ठयात भिंतुनेगु उगु ज्याझ्वलय् न्हूदँ राष्ट्रिय समारोह समिति ११४२ या नायः निरन्जन रत्न शाक्य, नेपालभाषा एकेडेमीया भाइस चान्सलर नेवाः न्ह्यलुवा मल्ल के सुन्दर,संस्कृतिविद् डा चुन्दा बज्राचार्य लगायतं मन्त्री श्रेष्ठयात खादाँ क्वखाएका भिन्तुना देछागु खः । ज्याझ्वलय् थःगु खँ तयेगु झ्वलय् मन्त्री श्रेष्ठं नेपाःया सांस्कृतिक सम्पदा  धइगु हे नेपाःया म्हसिका खः धका धासे पर्यटन व संस्कृतियात नापनापं यंकेफःसा नेपाःया विकास अझ च्वने्ह्याइगु जुउगुलिं येँ या लायकु लागां निसें स्वयम्भु तकया सांस्कृतिक पद मार्ग दयेकेगु ज्या न्ह्याके धुनागु खँ न्ह्यथना दिल । जनकवि श्रेष्ठं पदय् थ्यंका थःयात शासक कथं मखसे सेवक कथं कायेफयेमा धका भिंतुना दिल ।","  २०७९ आषाढ २५, शनिबार "
पत्रकार दबु चितवन शाखाया न्हूगु ज्यासना पुचःया ल्यःज्या व हना ज्याझ्वः क्वचाल,"          नेवाः पत्रकार राष्ट्रिय दबु चितवन शाखाया न्हूम्ह नायः कथं अनुज जोशीयात ल्यःगु दु। शनिबार भरतपुरय् जुगु खुक्वःगु दँमुन्ज्या व स्वक्वःगु तःमुन्ज्याँ जोशीयात सर्वसम्मत नायः कथं ल्यःगु खः।  जोशीया नेतृत्वय् गुम्ह दुजःया न्हू ज्यासना पुचः ल्यःगु उगु तःमुन्ज्याय् न्वकु सृजना ताम्राकार, छ्यान्जे सुनिल कुमार श्रेष्ठ, लिउ छ्यान्जे विनिता श्रेष्ठ व दाँभरीं राजु श्रेष्ठयात ल्यःगु खः। अथेहे दुजःपि राजेन्द्र श्रेष्ठ, उमेश श्रेष्ठ, मनिषा श्रेष्ठ व निरुता श्रेष्ठयात ल्यःगु खः। निर्वाचन कमिटिया संयोजक नाप पत्रकार दबुया संस्थापक अध्यक्ष श्रीकृष्ण महर्जन व  पत्रकार दबूया दाँभरीं सुरेन्द्रभक्त श्रेष्ठं निर्वाचित जुयादीपिन्त खादा व अबिर टिंका भिंतुना बियादीगु खः।  उगु ज्याझ्वलय् थःथःगु ख्यलं ज्वमदुगु योगदान बियादीपिं चिकित्सक व पत्रकारपिन्त न सम्मान यानादीगु खः। पत्रकार दबू चितवन शाखाया खुक्वःगु दँमुन्ज्या व स्वक्वःगु तःमुन्ज्याया मूपाहाँ पत्रकार दबुया बरिष्ठ केन्द्रीय न्वकु नृपेन्द्रलाल श्रेष्ठं त्वाः देवाय् मत च्याका  ज्याझ्वःया उलेज्या यानादीगु खः।  मूपाहाँ बरिष्ठ केन्द्रीय न्वकु श्रेष्ठं चिकित्सक व पत्रकारपिन्त नं सम्मान यानादीगु खः। स्वास्थ्य क्षेत्रय् योगदान बियादीपि वरिष्ठ हाडजोर्नी व नसा रोग विशेषज्ञ प्रा डा अर्जुन श्रेष्ठ, वरिष्ठ प्वाः नाप कलेजो रोग विशेषज्ञ डा बरुण श्रेष्ठ, वरिष्ठ क्यान्सर सर्जन प्रा डा भक्तमान श्रेष्ठ, जनरल व ल्याप्रोस्कोपिक डा सुर्यज्योती श्रेष्ठपिन्त  वयकलं हनापौं लःल्हानादीगु खः। अथेहे पत्रकारिता ख्यलय् ताः ईनिसे योगदान यानादीपि स्वम्ह वरिष्ठ पत्रकारपिन्त नं हनेज्या जुउगु ज्याझ्वलय् पत्रकार दबु चितवनया संस्थापक नायः अमर प्रधान, पत्रकार महासंघ चितवनया पुलांम्ह नायः महेन्द्र श्रेष्ठ, वरिष्ठ स्वास्थ्य पत्रकार नाप पत्रकार दबुया केन्द्रीय न्वकु सन्दीपकुमार श्रेष्ठयात न उगु ज्याझ्वलय् सम्मान याउगु खः।","  २०७९ श्रावण १५, आइतबार "
