headline,final_news,date
ताइवानयात अमेरिकां सुरक्षा बीः– बाइडेन,"एजेन्सी- अमेरिकाया राष्ट्रपति जो बाइडेनं चीनं ताइवानय् आक्रमण यात धाःसा अमेरिकां ताइवानयात सुरक्षा बिइ धाःगु दु । बाइडेनं ताइवानया रक्षाया निंतिं थःपिं प्रतिवद्ध दु धकाः धाःगु खः । छगू ज्याझ्वलय् पत्रकारतय्सं चीनं ताइवानय् आक्रमण यात धाःसा अमेरिकां छु याइ धयागु न्ह्यसः तःबलय् बाइडेनं थ्व प्रतिक्रिया बिउगु खः ।
                    
                    
                 बाइडेनया थ्व प्रतिक्रिया लिपा ह्वाटस हाउसं अमेरिकाया ताइवान नीतिइ हिउपा वःगुकथं मकायेत स्पष्ट याःगु दु । ताइवानया रक्षायात कयाः अमेरिकां ‘रणनैतिक अस्पष्टता’ नीति नालाकया वयाच्वंगु खः । थुकिया अर्थ चीनं ताइवानय् आक्रमण यात धाःसा अमेरिकां छुं यायेगु धयागु खँय् चायेकचायेक हे स्पष्ट मजुयाच्वंगु खः । चीनं ताइवानयात थःगु प्रान्तकथं कयाच्वंगु दु, अले माःसा शक्ति छ्यलाः ताइवानयात थःपिनिगु मातहतय् हयेफु धयाच्वंगु दु । ताइवानं धाःसा थःपिंत सार्र्वभौसत्ता राष्ट्र धयावयाच्वंगु दु । बाइडेनं चीनलिसे अन्तर्राष्ट्रिय द्वन्द्व याये माःसां चिन्तित मजुयागु नं धाःगु खः । ‘अमेरिकायाके विश्वया इतिहासय् शतिmशाली सेना दुगु खँ चीन, रुस व विश्वं सिउ’ बाइडेनं धाःगु दु । ताइवान व अमेरिकाया दथुइ कुटनीतिक स्वापू मदुसां अमेरिकां ताइवानयात थीथी ल्वाभः धाःसा मियावयाच्वंगु दु ।",???? ?????? दुतिया
डोनाल्ड ट्रम्पपाखें न्हूगु सामाजिक सञ्जालया घोषणा,"एजेन्सी- अमेरिकाया पूर्व राष्ट्रपति डोनाल्ड ट्रम्पं न्हूगु सामाजिक सञ्जालया घोषणा याःगु दु । ट्रम्पं थःगु हे सामाजिक सञ्जाल ‘ट्रूथ सोशल’ सार्वजनिक यायेगु घोषणा याःगु खः । ट्रम्पं थ्व सामाजिक सञ्जाल ट्विटर व फेसबुक थेज्याःगु तःधंगु प्रविधि दुगु कम्पनीया अत्याचारविरुद्ध दनीगु व अमेरिकाया ‘विद्रोही सः’यात थाय् बिइगु धाःगु दु । डोनाल्ड ट्रम्प अध्यक्ष जूगु कम्पनी ट्रम्प मिडिया एन्ड टेक्नोलोजी ग्रुप (टिएमटीजीं) थ्व सामाजिक सञ्जाल दयेकूगु खः । कम्पनीं भिडियो स्ट्रीमिङ सेवा, पोडकास्ट व समाचार सेवा नं बिइगु जुइ ।
                    
                    
                 अमेरिकाया पूर्व राष्ट्रपति डोनाल्ड ट्रम्पयात सामाजिक सञ्जाल ट्विटर व फेसबुकं निलम्बन यानातःगु दु । ट्रम्पया समर्थकत अमेरिकाया संसद भवन दुहां वंगु घटनालिपा ट्रम्पयात निगुलिं सामाजिक सञ्जालं वयात निलम्बन याःगु खः । सामाजिक सञ्जालय् निलम्बित जूगु छुं ई लिपा हे ट्रम्प थःगु हे सामाजिक सञ्जाल दयेकेगु धाःगु खः । सामाजिक सञ्जाल ‘ट्रूथ सोशल’ वइगु महिनाय् छुं आमन्त्रित प्रयोगकर्ताया निंतिं तयार जुइगु व सन् २०२२या न्हापांगु स्वलाया दुने अमेरिकाय् उपलब्ध जुइगु ट्रम्पया कम्पनी टिएमटीजीं जानकारी बिउगु दु । ट्रम्पं धाःगु दु ‘तालिबानतय्गु ट्विटरय् तःधंगु उपस्थिति दु, तर अमेरिकाया यःम्ह राष्ट्रपति सुम्क च्वनाच्वनेमाःगु दु । दक्वसिनं जितः न्यनी मेगु तःधंगु प्रविधि दुगु कम्पनी मदुला ? जिपि याकनं हे वयेत्यनागु दु ।’",???? ??????? पारू 
फुमिओ किशिडा जापानया न्हूम्ह प्रधानमन्त्री जुइगु,"एजेन्सी- फुमिओ किशिडा जापानया न्हूम्ह प्रधानमन्त्री जुइगु निश्चित जूगु दु । जापानया सत्तारुढ पार्टी लिबरल डेमोक्रेटिक (एलपिडी)या नेता फुमिओ किशिडा बुधवाः जूगु आन्तिरक निवार्चनय् पार्टीया प्रमुख नेता चयन जूगु खः । बुधवाः जूगु आन्तरक निर्वाचनय् किशिडां खोपमन्त्री तारो कोनोयात बुकूगु खः ।
                    
                    
                 निर्वाचनय् किशिडां २५७ मत व कानों १७० मत हःगु खः । न्हापांगु चरणय् निम्हेसिनं नं स्पष्ट बहुमत महःगुलिं निगूगु चरणया निवार्चन जूगु खः । किशिडां जापानय् वइगु नोभेम्बरय् जुइगु आम निर्वाचनया नेतृत्व याइ । जापानया निगुलिं सदनय् सत्तारुढ पार्टी लिबरल डेमोक्रेटिकया बहुमत दु । एलपिडीया नेता फुमिओ किशिडायात संसदीय प्रक्रिया लिपा जापानया प्रधानमन्त्रीया जिम्मेवारी बिइगु जुइ । प्रधानमन्त्री सुगाया राजीनामाया घोषणा लिपा न्हूम्ह प्रधानमन्त्री ल्यःगु खः ।",???? ?????? अष्टमी
अफ्रिकाय् मलेरिया विरुद्धया खोपयात ऐतिहासिक स्वीकृति,"एजेन्सी÷ अफ्रिकाय् छगू दशकया कुतः लिपा तयार जूगु मलेरिया विरुद्धया खोपयात स्वीकृति बिउगु दु । अफ्रिकाय् मलेरियां यानाः यक्व मस्त सिनाच्वंगु खः । खोपया स्वीकृति बिइव मलेरिया विरुद्ध अभियानय् थुकियात ऐतिहासिक सफलताकथं काःगु दु । चिकित्सा क्षेत्रया तःधंगु उपलब्धिकथं थ्व खोपया निर्माणयात काःगु दु ।
                    
                    
                 विश्व स्वास्थ्य संगठनं अफ्रिकाया थीथी देसय् खोपया परीक्षण याःगु खः । अफ्रिकी देय् घाना, केन्या, मालवीं खोपया परीक्षण यायेधुंकाः विश्व स्वास्थ्य संगठनं खोपयात स्वीकृति बिउगु खः । आः थ्व खोप सब साहारा अफ्रिका व मलेरिया संक्रमण दर उच्चनिसें मध्यम खनेदुगु थासय् वितरण याइगु जुइ । विश्व स्वास्थ्य संगठनया महानिर्देशक डा. टेड्रोस एड्हानोम गेब्रेयससं थुकियात ऐतिहासिक क्षण धाःगु दु । डा. टेड्रोसं ताः ईया कुतः लिपा मस्तय्त जुइगु मलेरियाविरुद्धया खोप स्वीकृत जूगु धयागु विज्ञान, बाल स्वास्थ्य व मलेरिया नियन्त्रणया निंति उपलब्धी खः धाःगु दु । डा. टेड्रोसं खोपं स्वीकृत जूगुलिं द्वलंद्वः मनूतय्त बचे यायेफइगु नं धाःगु दु । अफ्रिकाय् मलेरियां सन् २०१९ य् जक निगू लख व ६०द्वः मस्त सीगु खः ।",???? ??????? पारू 
‘लिंग व जातिया आधारय् नोबेल सिरपाः बीमखु’,"एजेन्सी- रोयल स्वीडस एकाडेमि अफ साइन्सेजया प्रमुख योरान हानसनं छुं नं लिंग वा जातिया आधारय् नोबेल सिरपाः मबीगु खँ धयादीगु दु । थ्व संस्था विज्ञान पाखे नोबेल पुरस्कार बीगु प्रतिस्थान खः । वय्कलं छुं नं लिंग वा जातिया आधारय् मखसे महत्वपूर्ण खोज याःगु कारणं सिरपाः त्याकेमाः धयागु थःपिंसं तायेकागु खँ धयादीगु दु ।
                    
                    
                 सन् १९०१ निसें नोबेल सिरपाः बीगु याना वयाच्वंगु खःसा सछि व नीदँ थ्यनेधुंकाः आःतक मुक्कं ५९ म्हे मिस्तय्सं जक नोबेल सिरपाः त्याकेत ताःलाःगु दु । थ्व दँय् नं फिलिपिन्सया पत्रकार मारिया रेसा छम्ह हे जक नोबेल त्याकेत ताःलाःम्ह मिसा जूगु दु । रेसायात रुसी पत्रकार दिमित्री मुरातोभलिसें थुगुसीया नोबेल शान्ति पुरस्कार बीगु घोषणा याःगु खः । वय्कःपिंसं थःथःगु देसय् अभिव्यक्ति स्वतन्त्रताया रक्षाया निंतिं याःगु ज्याया निंतिं थ्व पुरस्कार बीगु क्वःछिउगु खः । ‘नोबेल पुरस्कार त्याकूपिं मध्ये मिस्त तसकं म्हो जक दुगु तसकं दुःखद खः, थुकी समाजय् दुगु अनुचित अवस्था क्यनी । तर जिमिसं लिंग वा जातिया आधारय् कोटा मतयेगु निर्णय यानागु दु’ वय्कलं धयादीगु दु । थ्व निणर्य नोबेलया संस्थापक अल्फ्रेड नोबेलया अन्तिम इच्छाया मर्मय् आधारित जूगु खँ नं वय्कलं धयादीगु दु । स्वीडिस उद्योगपति व रसायनशास्त्री अल्फ्रेड नोबेलं थः सी दछि न्ह्यः सन् १८९५ य् थ्व सिरपाः नीस्वनेगु थःगु इच्छापत्रय् च्वयाथकूगु खः ।",???? ??????? सप्तमी
अस्ट्रियाय् खोप मकाःपिंत लकडाउन,"एजेन्सी- अस्ट्रियाया सरकारं कोरोनाविरुद्ध पुरा खोप मकानीपिं करिब निगू लाख मनूतय्त सोमवाः निसें लकडाउनय् तःगु दु । अन्तर्राष्ट्रिय सञ्चार माध्यमयाकथं खोप मकाःनिपिं मनूत अत्यावश्यक ज्या बाहेक छेँय् नं पिहां वये दइमखु । १२ दँसिबें च्वय्यापिं खोप मकानिपिं सकसितं थ्व नियम लागु जुइ । नयेगु ज्वलं न्याः वनेत, डाक्टरथाय् वनेत व खोप काःवनेत बाहेक पिहां वये मदुगु नियमय् दु ।
                    
                    
                 अष्ट्रियाया चान्सलर अलेक्जेन्डर शेलेनवर्गं सरकारया थ्व पलाः दुर्भाग्यपूर्ण जूगु तर आवश्यक जूगु धाःगु दु । नियम पालना मयाःपिंत १६६० डलर जरिवाना जुइ । अस्ट्रियाय् ६५ प्रतिशत जनसंख्यां खोप कायेधुंकूगु दु,तर पश्चिम युरोपय् थ्व प्रतिशत दकलय् कम खः । अस्ट्रियाय् कोरोना संक्रमण नं थहां वनाच्वंगु दु । विश्व स्वास्थ्य संगठनं युरोपय् हाकनं कोरोना संक्रमण अप्वयेफुगु धयावयाच्वंगु दु ।",११४२ कछलाथ्व एकादशी
छ्यंया मू ५० लाख डलर तयातःम्ह कुख्यात तस्कर ज्वन,"एजेन्सी- कोलम्बियाया कुख्यात लागुपदार्थ तस्कर व तःधंगु आपराधिक पुचःया नायःयात ज्वंगु दु । ओटोनियल धकाः नांजाःम्ह कुख्यात लागुपदार्थ तस्कर डायरो एन्टोनियो उसागायात कोलम्बियाया छगू ग्रामीण लागां ज्वंगु अन्तर्राष्ट्रिय समाचार माध्यमं जानकारी बिउगु दु । ओटोनियलयात शनिवाः सेना, वायुसेना व प्रहरीं संयुक्त अपरेशन यानाः ज्वंगु खः । कोलम्बियाया सरकारं ओटोनियलया जानकारी बिउम्हेसित च्यागू लाख सिरपाया घोषणा यानातःगु खः । अमेरिकां उसागाया छ्यंया मू ५० लाख डलर तयातःगु खः ।
                    
                    
                 कोलम्बियाया राष्ट्रपति इभान ड्युकं ओटोनियलयात ज्वने धुंकाः टेलिभिजनपाखें सम्बोधन याःगु खः । राष्ट्रपति इभानं लागू वासः तस्कर विरुद्ध थ्व शताब्दीया हे तःधंगु सफलता जूगु नं धाःगु खः । । राष्ट्रपति इभानं ओटोनियलया तुलना सन् १९९०या लागू वासःया कुख्यात नाय पाब्लो एस्कोबारया पतनलिसे याःगु खः । राष्ट्रपति इभानं ओटोनियलयात ज्वंगुलिं ‘गल्फ क्लानया अन्त्य’ शुरु जूगु धाःगु दु । झिदँ न्ह्यः ओटोनियलं थः दाजुयात प्रहरी स्यानाबिइ धुकाः गल्फ क्लानया स्थापना याःगु खः । थ्व पुचःयात कोलम्बियां शक्तिशाली आपराधिक संगठनकथं कयातःगु खःसा अमेरिकां थुकियात सशस्त्र हिंसात्मक पुचःकथं कयातःगु खः । थ्व पुचलय् १८०० सिबें अप्व सदस्य दु । ओटोनियलयात मेगु राष्ट्रयात सुपुर्दगी यायेगु तयारी जुयाच्वंगु दु । ओटोनियलयात अमेरिकायात लःल्हाइगु सम्भावना दु ।",???? ?????? चौथी
अस्टे्लियां विद्यार्थीतय्गु निंतिं अन्तर्राष्ट्रिय सिमाना चायेकीगु,"एजेन्सी- अस्टे्लियां विद्यार्थीतय्गु निंतिं अन्तर्राष्ट्रिय सिमाना चायेकीगु २० ला लिपा विद्यार्थीतय्गु निंतिं अन्तर्राष्ट्रिय सिमाना चायेकीगु जूगु दु । कोरोना महामारीया कारणं बन्द जुयाच्वंगु सिमाना थ्व हे वइगु डिसेम्बर १ तारिख निसें चायेकेत्यंगु खः । सोमवाः पत्रकार सम्मलेनय् नवासें अस्टे«लियाया प्रधानमन्त्री स्कट मोरिसनं विद्यार्थी, शरणार्थी, व्यापारिक भिसा दुपिं व दक्ष ज्यामितय्त अस्टे«लियाय् प्रवेशया अनुमति बिइगु धाःगु दु । अथे हे दक्षिण कोरिया व जापानया पयर्टकतय्त अस्टे«लिया प्रवेशया अनुमति बिउगु दु ।
                    
                    
                 अस्टे्लिया वनेत अस्टे्लिया सरकारं मान्यता बिउगु कोरोना विरुद्धया खोप कायेधुंकूपिं जुइमाः । अस्टे्लियां फाइजर, जोन्सन एण्ड जोन्सन, एस्ट्रजेनेका व मोर्डेना खोपयात मान्यता बिउगु दुसा चीनं दयेकूगु खोपयात मान्यता बिउगु मदु । अस्टे्लिया वइपिं विद्यार्थीतय्सं क्वारेन्टाइनय् च्वनेमाः कि म्वाः धयागु निर्णय धाःसा स्थानीय सरकारं याइगु जुइ । क्यापिटल टेरिटोरी, न्यू साउथ वेल्स व भिक्टोरिया राज्यं पूर्ण खोप कायेधुंकूपिंसं क्वारेन्टाइनय् च्वनेम्वाः धकाः निर्णय यायेधुंकूगु दु । अस्टे्लियाया गृहमन्त्रालयं पिकाःगु सुचंकथं २८गू थीथी शीर्षकया भिसावाहक विदेशी नागरिकतय्सं डिसेम्बर १ तारिखनिसें अस्टे«लियाय् वनेखनी । मन्त्रालयं पिकाःगु सुचनय् विद्यार्थी, दक्ष ज्यामि, शरणार्थी, मानवीय, वर्क एण्ड होलिडे आदि शीर्षक दु । अस्टे्लिया सरकारं थःपिनिगु अर्थतन्त्र बांलाकेगु निंतिं थ्व पलाः ल्ह्वंगु खः । प्रधानमन्त्री मोरिसनं अर्थतन्त्र व ज्यामितय्गु परिपुर्ति यायेत थ्व पलाः आवश्यक जूगु धाःगु दु । अस्टे्लियाय् विद्यार्थीतय्सं जक २५ अर्ब अमेरिकी डलर योगदान यानावयाच्वंगु दु । थौकन्हय् नेपालय् च्वंपिं थ्यंमथ्यं न्याद्वः नेपाली विद्यार्थीतय्सं नेपालय् च्वना हे अस्टे«लियाया विश्वविद्यालयपाखें अनलाइन क्लास कया वयाच्वंगु दु ।",११४२ कछलागा तृतीया
