headline,final_news,date
ट्रम्प अस्पतालं लिहां वन,"एजेन्सी – कोरोना भाइरसया सफल उपचार लिपा अमेरिकी राष्ट्रपति डोनाल्ड ट्रम्प अस्पतालं लिहां वंगु दु। स्वन्हु अस्पतालय् च्वनेधुंकाः ट्रम्प ह्वाइट हाउस लिहां वंगु खः । वय्कलं आः याकनं हे थःगु चुनावी अभियानय् ब्वति काइगु खँ धाःगु दु ।
                    
                    
                 अस्पतालं हेलिकप्टर पाखें ह्वाइट हाउस वंम्ह ट्रम्पया उपचार ह्वाइट हाउसय् नं जारी हे जुइगु खँ चिकित्सकतय्सं धाःगु दु। ह्वाइट हाउस थ्यनेधुंकाः राष्ट्रपति ट्रम्पं धाःगु दु, ‘धाथें आराम महसुस यानाच्वनागु दु। कोभिड खनाः ग्यानादीमते । ह्वाइट हाउस थ्यनेधुंकाः वय्कः याकःचा च्वनाच्वंगु किपा पिहां वःगु दु। उकी नं वय्कलं सैनिकतय्सं थें अभिभावदन याये न्ह्यसः मास्क लिकयातःगु खनेदु। वय्कःया उपचारय् संलग्न डा. सीन कोन्लीं ट्रम्पया स्वास्थ्य सुधार जुयाच्वंसां पूर्ण रुपं ठीक मजूनिगु खँ धाःगु दु। वय्कःया वाःया न्हयन्हुं, २४ सै घन्टा विश्वया उत्कृष्ट चिकित्सकतय् निगरानीइ दइगु खँ डा. कोन्लीं धयादीगु दु । अस्पतालं विदा जुइगु झ्वलय् वय्कलं सकसितं सुभाय् बियादीगु दु, तर छुं नं न्ह्यसःया लिसः धाःसा बियादीगु मदु। वय्कःयात छम्ह संववादातां छु छि सुपर स्प्रेडर खः ला धकाः न्ह्यसः तःगु खः । थ्वहे दथुइ ह्वाइट हाउसय् थप कर्मचारीतय्त संक्रमण पुष्टि जूगु दु। ट्रम्पलिसे सतिपिं म्होतिं नं १२ म्हेसिके पोजिटिभ खनेदुगु दु। मेखे कोरोना संक्रमणया हे इलय् अस्पतालं गाडीइ च्वनाः चाःहिउवःगु खँ यात कयाः राष्ट्रपतिया तःधंगु आलोचना नं सुरु जूगु दु। वय्कः थथे चाःहिउवःगु कारणं वय्कःया सुरक्षाय् खटे जुयाच्वंपिं सुरक्षाकर्मी, गाडी चालक नं जोखिमय् लाःगु धासें वय्कःया आलोचना जूगु खः ।",११४० अनलागा पञ्चमी
राष्ट्रपति ट्रम्पयात कर छले याःगु द्वपं,"एजेन्सी – अमेरिकी राष्ट्रपति डोनाल्ड ट्रम्प अमेरिकाया अर्बपतिमध्ये छम्ह खः । थुम्ह अर्बपति राष्ट्रपति ट्रम्पयात कर छले याःगु द्वपं लाःगु दु। अर्बपति अमेरिकी राष्ट्रपति डोनाल्ड ट्रम्प विरुद्ध आयकर चुक्ता मयाःगु द्वपं लाःगु दु। अमेरिकाया राष्ट्रपति निर्वाचन न्ह्यः हे ट्रम्प छम्ह अर्बपति जूगु समाचार पिहां वःगु खः । राष्ट्रपतिइ निर्वाचित जूगु हे दँय् ट्रम्पं ७५० अमेरिकी डलर जक संघीय आयकरयात पूगु खुलासा जूगु दु ।
                    
                    
                 अमेरिकाया राष्ट्रपतिइ निर्वाचित जूगु दँय् अर्बौंया मालिक ट्रम्पं जम्मा ७५० डलर जक अमेरिकी संघीय आयकर विभागयात पूगु खुला अमेरिकी पत्रिका ‘न्यूयोर्क टाइम्सं’ याःगु खः ।  न्यूयोर्क टाइम्सया कथं राष्ट्रपति ट्रम्पं वंगु १५ दँया दुने न्यादँया जक आयकर पूगु दुसा मेगु १० दँया आयकर पूगु मदु। थःगु कम्पनी द्यापनय् वंगु धासें वंगु १० दँ तक कर मपूम्ह ट्रम्पयात कर छले याःगु द्वपं बिउगु दु। राष्ट्रपतिया वर्तमान कार्यकाल सिधयेत्यंगु व निक्वःगु कार्यकालया निंतिं राष्ट्रपतिया निर्वाचनया दावेदारया रुप न्ह्यःने वनाच्वंम्ह ट्रम्प विरुद्ध राष्टपति पदया निर्वाचन जुइ करिब लछि जक ई ल्यं दुगु इलय् उकथं कर छले याःगु द्वपं लाःगु खः । उखे न्यूयोर्क टाइम्सं च्वःगु समाचारयात कयाः ट्रम्पं आपत्ति प्वंकूगु दु। न्यूयोर्क टाइम्सया समाचार पूणरुपं फय्गं जूगु धासें समाचारप्रति ट्रम्पं आपत्ति प्वंकूगु खः। न्यूयोर्क टाइम्सं सन् १९९० निसें थःपिंसं ट्रम्पया कम्पनीया करसम्बन्धी विवरण अध्ययन यानाच्वनागु दावी याःगु दुसा सन् २०१६ व २०१७ य् ट्रम्पया व्यक्तिगत कर विवरणतकं थःपिंसं अध्ययन यानागु दावी याःगु दु । उखे ट्रम्पं टाइम्सया समाचारय् छुं नं सत्यता मदुगु व थम्हं कर पुलागु जिकिर याःगु दु ।",११४० अनलाथ्व त्रयोदशी 
भारतय् ज्या बन्द यायेगु एम्नेष्टीया घोषणा,"दिल्ली (एजेन्सी) – अन्तर्राष्ट्रिय मानव अधिकारवादी संस्था एम्नेष्टी इन्टरनेशनलं भारतय् आवंलि थःपिनिगु ज्या बन्द यायेगु घोषणा याःगु दु। भारतया प्रवर्तन निर्देशनालय (इडीं) संस्थाया खाता बन्द यायेगु घोषणा यायेवं एम्नेष्टीं उगु घोषणा याःगु खः ।
                    
                    
                 इडीं दछि न्ह्यः सीबीआई मार्फत प्रहरीइ छगू उजुरी दर्ता यायेवं अनंनिसें बिस्कंकथं जांच शुरु याना वयाच्वंगु खः । विदेशी चन्दा कायेगु बारे दयेकातःगु कानून ‘एफसीआरए’ हाचां गायेगु ज्या नं एम्नेष्टीं याःगु भारत सरकारं द्वपं बिउगु दु। उखे एम्नेष्टीं भारत सरकारं मानव अधिकारवादी संस्थातय्त ‘विच-हन्ट’ यानाच्वंगु द्वपं बिउगु खँ धाःगु दु। भारत सरकारं याःगु अवरोध व आक्रमणया कारणं थःपिं ज्या बन्द यायेगु निर्णय यायेत बाध्य जूगु एम्नेष्टीं स्पष्ट याःगु दु । भारत सरकारं थःपिनि कर्मचारीयात विदा यायेत, थःपिनिगु सकतांकथंया अभियान व अनुसन्धानात्मक ज्याझ्वः नं दिकेत बाध्य याःगु एम्नेष्टीं न्ह्यथंगु दु। एम्नेष्टीं भारतय् थःगु ज्या बन्द यायेगु घोषणा यासें जारी याःगु छगू विज्ञप्तीइ सरकारं बदलाया भावना स्वरुव याःगु कारवाही जूगु धासें भारत सरकार हे जिम्मेवार जूगु खँ धाःगु दु । वंगु सेप्टेम्बर १० कुन्हु इडीं थःपिनिगु दक्वं बैंक खाता दक्वं फ्रिज याना बिउगु पत्ता लगे जूगु व थुकिं यानाः मानवअधिकारवादी संस्थाया आपालं ज्या नं प्रभावित जू वंगु एम्नेष्टीं न्ह्यथंगु दु। लिसें थःपिनिगु संस्थाया ज्यापाखें भारतया पीगू लाख स्वयां अप्वः मनू प्रत्यक्ष रुपं लाभान्वित जुयाच्वंगु व छगू लाख स्वयां अप्वः चन्दादाता भारतीय हे जूगु नं न्ह्यथंगु दु । जम्मू काश्मिर, दिल्लीइ जूगु घटनाया पारदर्शीता व उत्तरदायी जुइत माग तयाः थःपिंसं वकालत यानागुलिं हे मोदी सरकार थःपिलिसे तम्वःगु एम्नेष्टीं न्ह्यथंगु दु। वंगु फेब्रुअरी महिनाय् दिल्लीइ जूगु घटनाय् मानवअधिकारया उल्लंघन जूगु रिपोर्ट एम्नेष्टीं करिब लछि न्ह्यः जक सार्वजनिक याःगु खः । गुगु रिपोर्टयात कयाः दिल्ली प्रहरीं खण्डन याःगु जक मखसे उगु रिपोर्ट, यकःति, पक्षपाति व विद्वेषपूर्ण जूगु नं धाःगु खः । विश्वन्यंकंया मानवअधिकारया क्षेत्रय् ज्या याना वयाच्वंगु व स्थापित संस्था एम्नेष्टीं भारतय् ज्या मयायेगु धकाः याःगु घोषणायात छखे अर्थपूर्ण रुपं कया हयाच्वंगु दुसा मेखे एम्नेष्टीया ज्या बन्द यायेगु निर्णयप्रति भारत सरकारं छुं नं प्रतिक्रिया बिउगु मदुनि ।",११४० अनलाथ्व चतुर्दशी
सुशान्तया हत्या जूगु मखु,"एजेन्सी – भारतया दिल्लीइ च्वंगु एम्स अस्पतालया मेडिकल बोर्डं अभिनेता सुशान्त सिंह राजपूतयात विष नकाः हत्याः याःगु धइगु आशंकायात खारेज यानाबिउगु दु। एम्स अस्पतालया मेडिकल बोर्डं सीबीआईयात बिउगु अन्तिम रिपोर्टय् थ्व खँ न्ह्यथनातःगु खँ ‘द टाइम्स अफ इन्डियां’ च्वःगु दु। थ्व रिपोर्टय् सुशान्त सीगुया सही कारण न्ह्यथनातःगु खँ धाःगु दु ।
                    
                    
                 बोर्डया अध्यक्ष डा. सुधीर गुप्तां टाइम्स अफ इन्डियालिसे खँ ल्हासें धाःगु दु, ‘फोरेन्सिक टिमं याःगु परीक्षणया लिच्वः सुयातं कने मजिउ, छाय्धाःसां थ्व मुद्दा विचाराधीन दु। अनुसन्धान यानाच्वंपिं सीबीआईयात थ्व रिपोर्ट बीधुनागु दु ।’ अभिनेता राजपूतयात वंगु जून १४ तारिखय् मुम्बइलय् च्वंगु थःगु हे छेँय् झुन्डे जुयाः सीनाच्वंगु अवस्थाय् लुइकूगु खः । वं आत्महत्या याःगु खँ मुम्बइ प्रहरीं धाःगु खः, तर वयागु हत्या नं जूगु जुइफु धकाः सः तच्वया वयेवं सीबीआई मार्फत अनुसन्धान न्ह्याकूगु खः । सीबीआईया हे इनापय् एम्सं मेडिकल बोर्ड गठन यानाः सुशान्त च्वनाच्वंगु छेँया नं फोरेन्सिक जाँच याःगु खः । सुशान्तया पोस्टमार्टम याःपिं कूपर अस्पतालया डाक्टरतय्के नं बोर्डपाखें अन्तर्वार्ता काःगु खः । मेडिकल बोर्डं लछि तकया अनुसन्धान लिपा थ्व निष्कर्ष पिकाःगु खः ।",११४० अनलाथ्व पुन्हि
इतिहासय् खराब बहस ज्याझ्वः,"एजेन्सी – अमेरिकाय् वइगु नोभेम्बर महिनाय् राष्ट्रपतिया निर्वाचन जू वनाच्वंगु दु। थ्व अवस्थाय् राष्ट्रपति पदया निम्ह उम्मेदवारयात कयाः छगू टेलिभिजन बहस ज्याझ्वः जुल ।
                    
                    
                 अमेरिकी राष्ट्रपति पदया निम्ह उम्मेदवार वर्तमान राष्ट्रपति रिपब्लिकनया डोनाल्ड ट्रम्प व मेम्ह राष्ट्रपतिया दावेदार डेमोक्र्याटिकया जो वाइडेन दथुइ टेलिभिजन बहस जूगु खः । राष्ट्रपतिया निम्ह प्रत्याशी दथुइ जूगु थुगु टेलिभिजन बहसयात इतिहासया हे ‘खराब बहस’या संज्ञा बिउगु दु। निम्ह उम्मेदवारया दथुइ जुयाच्वंगु टेलिभिजन बहसय् ट्रम्पं वाइडेनयात नवाके हे मबिसे हस्तक्षेपया रणनीतिइ कुहां वयेवं बहस संचालन यानाच्वंम्ह प्रस्तोतां ट्रम्पयात तकं हक्के माःगु स्थिति ब्वलंगु खः । बहसया इलय् थः प्रतिस्पर्धीप्रति सामान्य शिष्टाचारतकं मक्यनेवं बहसया हे दथुइ ‘सट अप’ धकाः सुम्क च्वनेत धायेमाःगु अवस्था ब्वलंगु खः । थुगु बहस ज्याझ्वःपाखें खास मुद्दाय् बहस जुइगु व उम्मेदवारतय्सं नं थःथःगु धारणा व भावी ज्याझ्वः सार्वजनिक याःगु आशा याःगु खः । तर थुकथंया बहसं स्वकुमिलिसें मतदातातय्त तकं निराश यायेगु ज्या जूगु समाचार संस्थातय्सं टिप्पणी याःगु दु। विषयवस्तुइ दुहां वनेगु स्वयां नं विपक्षी उम्मेदवारया लिसः मन्यनेगु, न्यंसां धैर्य मयायेगु व छम्हं मेम्हेसिया दथुइ ततसलं हालाः ब्वःबीगु शैलीइ तकं कुहां वःगु खः । ‘फक्स न्युज च्यानल’या क्रिस वासलं संचालन याःगु बहस ज्याझ्वलय् न्हापांखुसी ट्रम्प व वाइडेन चुलिंचू जूगु खः । बहसय् मुख्य यानाः महामारी, रंगभेद, जलवायु परिवर्तन, अर्थतन्त्र, चुनावी स्वतन्त्रता लगायाया विषयत दुथ्याकातःगु खः । संचारमाध्यमतय्सं थुकियात बहस मखसे निम्हेसिया ल्वापुया नं संज्ञा बिउगु दु ।",११४० अनलाथ्व पुन्हि
बाबरी मस्जिद ध्वस्त याःगु द्वपं लाःपिं नेतातय्त सफाइ,"एजेन्सी – भारतया छगू अदालतं अयोध्याया बाबरी मस्जिद ध्वस्त याःगु मुद्दाय् सत्तारुढ भारतीय जनता पार्टी (भाजपा)या तःधंपिं नेतात सकसितं सफाइ बिउगु दु ।
                    
                    
                 सन् १९९२ य् हिन्दूतय् भिडं उगु मस्जिद थुनाबिउगु घटनाय् उमिसं छुं गलत ज्या मयाःगु धासें अदालतं सफाइ बिउगु खः । पुलांम्ह उपप्रधानमन्त्री लालकृष्ण आडवाणी व भाजपा नेता मुर ली मनोहर जोशी, उमा भारतीं अयोध्याय् झिंखुगूगु शदीइ दये कूगु बाबरी मस्जिद थुनेत हिन्दू अतिवादीतय्त उक्से याःगु धकाः बियातःगु द्वपंयात अस्वीकार याना वयाच्वंगु खः । थ्व घटना लिपा जूगु साम्प्रदायिक दंगाय् निद्वलं मल्याक मनूतय् ज्यान वंगु खः । अले थ्व हे ई भारतय् हिन्दू दक्षिणपन्थी राजनीतिया उदय जुइत छगू महत्वपूर्ण ई नं जुयाबिउगु खः । बुधवाः वःगु फैसलाय् ४९ म्ह आरोपित मध्ये ३२ म्हे सित सफाइ बिउगु खः । मेपिं झिंन्हय्म्ह धाःसा मुद्दाया फैसला वये न्ह्यः हे मदयेधुंकूगु खः । अदालतं बाबरी मस्जिद थुने गु योजना दयेकूगु पुष्टि याइगु गाक्क प्रमाण मदुगु धासें थज्याःगु फैसला न्यंकूगु खः । हिन्दूतय्सं उगु मस्जिद भगवान रामया जन्मस्थलय् दयेकूगु धकाः दावी याना वयाच्वंगु दु । थगुने सर्वोच्च अदालतं दशकौं तकया विवाद क्वचायेकेगु झ्वलय् थ्व थाय् हिन्दूतय्गु हे जूगु फैसला न्यंकूगु खः ।",११४० अनलागा पारू 
अमेरिकी राष्ट्रपति ट्रम्पयात कोरोना संक्रमण,"एजेन्सी – अमेरिकी राष्ट्रपति डोनाल्ड ट्रम्पयात कोराना भाइरसया संक्रमण जूगु दु । राष्ट्रपतिनाप सःतिक ज्या यानाच्वम्ह होप हिक्सयात कोरोना संक्रमण जुइवं राष्ट्रपति ट्रम्पं कोरोनाया परिक्षण याकादीगु खः । परिक्षणया झ्वलय् वयकःयात संत्रमण पुष्टि जूगु खः । वय्कः नापं अमेरिकाया फस्ट लेड मेलानिया ट्रम्पयात नं संक्रमण जूगु दु ।
                    
                    
                 होप हिक्सयात कोरोना संक्रमण जुइवं राष्ट्रपति ट्रम्प व मेलानिया ट्रम्प क्वारेन्टाइनय् च्वंगु खः । हिक्स क्लिभल्याण्डय् जूगु न्हापांगु राष्ट्रपति बहसय् ब्वति कायेत ट्रम्प नापं छगः हे विमानय् मंगलवाः उखे वंगु खः ।",११४० अनलागा पारू 
